Product Brand,Product Name,Ingredients,Clean Product
SHISEIDO,SHISEIDO Benefiance WrinkleResist24 Day Emulsion Broad Spectrum SPF 18,"Water, Cyclomethicone, Dipropylene Glycol, Glycerin, SD Alcohol 40-B, Xylitol, Phenyl Trimethicone, Dimethicone Copolyol, Magnesium Aluminum Silicate, Trimethylsiloxysilicate, Potassium Ascorbyl Tocopheryl Phosphate, Thiotaurine, Ginseng Extract, Sodium Acetylated Hyaluronate, Hydroxyproline, Wild Thyme Extract, Chlorella Vulgaris Extract, PEG-150, Distearyldimonium Chloride, Aluminum Hydroxide, Stearic Acid, Sodium Citrate, Butylene Glycol, Sodium Hexametaphosphate, Isopropyl Alcohol, Alcohol, Trisodium EDTA, BHT, Tocopherol, Phenoxyethanol, Methylparaben, Fragrance, Titanium Dioxide, Iron Oxides.",False
KIEHL'S SINCE 1851,KIEHL'S SINCE 1851 Daily Reviving Concentrate,"Caprylic/Capric Triglyceride, Dicaprylyl Ether, Dicaprylyl Carbonate, Squalane, Canola Oil Sunflower Seed Oil Unsaponifiables, Tocopherol, Limonene, Orange Peel Oil, Coriander Seed Oil, Calophyllum Inophyllum Seed Oil, Rosa Rubiginosa Seed Oil, Grapefruit Peel Oil, Ginger Root Oil, Linalool, Citral, Geraniol, Acerola Fruit Extract.",False
MURAD,MURAD Hydro-Dynamic® Ultimate Moisture,"Water, C12-15 Alkyl Benzoate, Caprylic/Capric Triglyceride, Glycerin, Sunflower Seed Oil, Butylene Glycol, Glyceryl Stearate, Glyceryl Behenate/Eiosadioate, Dicaprylyl Carbonate, Shea Butter, Cetearyl Alcohol, Myristyl Myristate, Cetyl Alcohol, Ethoxydiglycol, Phenyl Trimethicone, Stearic Acid, Oat Kernel Extract, Saccharomyces Cerevisiae Extract, Laminaria Digitata Extract, Yeast Amino Acids, Betaine, Inositol, Taurine, Trehalose, Soybean Sterols, Corn Starch, Olive Fruit Oil, Avocado Oil, Sodium Hyaluronate, Dipotassium Glycyrrhizate, Tetrahexyldecyl Ascorbate, Tocopheryl Acetate, Linoleic Acid, Phospholipids, Polysorbate 60, Acrylamide/Sodium Acryloyldimethyltaurate Copolymer, Isohexadecane, Glyceryl Polymethacrylate, Panthenol, Jojoba Alcohol, Potassium Jojobate, Polysorbate 80, Urea, Glucosamine HCI, PEG-8, Bisabolol, Sorbitan Oleate, Cetearyl Methicone, Dimethicone, Palmitoyl Oligopeptide, Retinyl Palmitate, Allantoin, Xanthan Gum, Disodium EDTA, BHT, Ethylhexylglycerin, Chlorphenesin, Phenoxyethanol.",False
MURAD,MURAD Retinol Youth Renewal Night Cream,"Water, Dimethicone, Glycerin, Butyrospermum Parkii (Shea) Butter, Stearyl Dimethicone, Caprylic/Capric Triglyceride, Arachidyl Alcohol, Octyldodecanol, Cetearyl Alcohol, Squalane, Borago Officinalis Seed Oil, Retinyl Propionate, Retinol, Swertia Chirata Leaf Extract, Urea, Yeast Amino Acids, Trehalose, Inositol, Taurine, Betaine, Glycine Soja (Soybean) Extract, Polymethylsilsesquioxane, Macrocystis Pyrifera (Kelp) Extract, Hydrolyzed Vegetable Protein, PVP, Ahnfeltiopsis Concinna Extract, Isopropyl Palmitate, Lecithin, Cetearyl Olivate, Octadecane, Disteardimonium Hectorite, Propylene Carbonate, Oleyl Alcohol, Dioscorea Villosa (Wild Yam) Root Extract, Glycine Soja (Soybean) Sterols, Hydrolyzed Yeast Extract, Cetyl Hydroxyethylcellulose, Polyglucuronic Acid, Sorbitan Olivate, Behenyl Alcohol, Arachidyl Glucoside, Tocopheryl Acetate, Zinc Gluconate, Sodium Polyacrylate, Dicaprylyl Carbonate, Polyglyceryl-3 Caprate, Xanthan Gum, Disodium EDTA, Sodium Hydroxide, Phenoxyethanol, Caprylyl Glycol, Chlorphenesin, Fragrance, Alpha-Isomethyl Ionone, Citronellol, Yellow 5 (CI 19140), Red 4 (CI 14700).",False
ESTÉE LAUDER,ESTÉE LAUDER Nutritious Vitality8™ Radiant Moisture Creme,Visit the Estée Lauder boutique,False
MURAD,MURAD Oil-Control Mattifier SPF 15 PA++,"Water, Cyclopentasiloxane, Bis-PEG/PPG-14/14 Dimethicone, Dimethicone Crosspolymer, Corn Starch Modified, Butylene Glycol, Chitosan , Ascorbic Acid, Polyglyceryl-3 Polydimethylsiloxyethyl Dimethicone, Triethoxysilylethyl Polydimethylsiloxyethyl Hexyl Dimethicone, Farnesyl Acetate, Panthenyl Triacetate, Argania Spinosa Kernel Extract, Serenoa Serrulata Fruit Extract, Sesamum Indicum (Sesame) Seed Extract, Punica Granatum Seed Oil, Sodium PCA, Betaine, Sorbitol, Glycine, Alanine, Proline, Serine, Threonine, Arginine, Lysine, Glutamic Acid, Capryloyl Glycine, Sarcosine, Cinnamomum Zeylanicum Bark Extract, Aluminum Starch Octenylsuccinate, Acrylates Copolymer, Magnesium Carbonate, Melaleuca Alternifolia (Tea Tree) Leaf Oil, Tocopheryl Acetate, Lauryl Methacrylate/Glycol Dimethacrylate Crosspolymer, Dicaprylyl Ether, Niacinamide, Yeast Extract (Faex), Aesculus Hippocastanum (Horse Chestnut) Seed Extract, Titanium Dioxide, Algae Extract, Ammonium Glycyrrhizate, Panthenol, Zinc Gluconate, Caffeine, Xanthan Gum, Acrylates Crosspolymer, Polyglyceryl-2 Dipolyhydroxystearate, Biotin, Salix Alba (Willow) Bark Extract, Aminomethyl Propanol, Disodium EDTA, Sodium Chloride, Propyl Gallate, Phenoxyethanol, Chlorphenesin.",False
KIEHL'S SINCE 1851,KIEHL'S SINCE 1851 Ultra Facial Oil-Free Gel-Cream,"Water, Glycerin, Alcohol Denat., Dimethicone, Isononyl Isononanoate, Carbomer, Imperata Cylindrica Root Extract, Dimethiconol, Caprylyl Glycol, Chlorphenesin, Sodium Hydroxide, Xanthan Gum, Pseudoalteromonas Ferment Extract, Tetrasodium Edta, Tocopheryl Acetate, Menthoxypropanediol, Phenoxyethanol, Biosaccharide Gum-1, Acrylates/C10-30 Alkyl Acrylate Crosspolymer.",False
MURAD,MURAD Skin Perfecting Lotion - Blemish Prone/Oily Skin,"Water, Dicaprylyl Maleate, C12-15 Alkyl Benzoate, Butylene Glycol, Glycerin, Sorbitan Stearate, Squalane, Stearic Acid, Retinol, Caprylic/Capric Triglyceride, Urea, Yeast Amino Acids, Trehalose, Inositol, Taurine, Betaine, Arnica Montana Flower Extract, Epilobium Angustifolium Flower/Leaf/Stem Extract, Hydrolyzed Soy Flour, Spiraea Ulmaria Extract, Honey (Mel) Extract, Cetearyl Alcohol, Ceteareth-20, Talc, Glycolipids, Sodium Hyaluronate, Panthenol, Lecithin, Avena Sativa (Oat) Kernel Protein, Tocopherol, Magnesium Ascorbyl Phosphate , Chondrus Crispus (Carrageenan) Extract, Dimethicone, Sodium PCA, Allantoin, Sclerotium Gum, Carbomer, Disodium EDTA, Aminomethyl Propanol, Phenoxyethanol, Caprylyl Glycol, Chlorphenesin, Citrus Aurantium Dulcis (Orange) Fruit Extract.",False
LA MER,LA MER The Moisturizing Soft Lotion,"Algae (Seaweed) Extract, Petrolatum, Isocetyl Stearoyl Stearate, Butyrospermum Parkii (Shea Butter), Butylene Glycol, Cyclopentasiloxane, Dimethicone, Glyceryl Stearate, Cetyl Esters, Phenyl Trimethicone, Diethylhexyl Succinate, Cyclohexasiloxane, Cholesterol, Steareth-10, Glyceryl Stearate Se, Polysilicone-11, Sesamum Indicum (Sesame) Seed Oil, Medicago Sativa (Alfalfa) Seed Powder, Helianthus Annuus (Sunflower) Seedcake, Prunus Amygdalus Dulcis (Sweet Almond) Seed Meal, Eucalyptus Globulus (Eucalyptus) Leaf Oil, Sodium Gluconate, Copper Gluconate, Calcium Gluconate, Magnesium Gluconate, Zinc Gluconate, Tocopheryl Succinate, Niacin, Sesamum Indicum (Sesame) Seed Powder, Water, Salicornia Herbacea Extract, Sigesbeckia Orientalis (St. Paul'S Wort) Extract, Citrus Aurantifolia (Lime) Peel Extract, Sea Salt/Maris Sal/Sel Marin, Chlorella Vulgaris Extract, Hydrolyzed Rice Extract, Micrococcus Lysate, Laminaria Digitata Extract, Plankton Extract, Caffeine, Glucose Oxidase, Trehalose, Sucrose, Acetyl Hexapeptide-8, Lactoperoxidase, Hydrolyzed Algin, Glyceryl Dilaurate, Alcaligenes Polysaccharides, Isohexadecane, Caprylic/Capric Triglyceride, Dipalmitoyl Hydroxyproline, Distearyldimonium Chloride, Glycerin, Tocopheryl Acetate, Steareth-21, Polyquaternium-51, Saccharide Isomerate, Tetrahexyldecyl Ascorbate, Sodium Pca, Urea, Glucose, Polysorbate 80, Sodium Hyaluronate, Cetyl Alcohol, Alcohol Denat., Acrylamide/Sodium Acryloyldimethyltaurate Copolymer, Fragrance, Lecithin, Bht, Linalool, Citronellol, Hydroxycitronellal, Geraniol, Limonene, Benzyl Salicylate, Phenoxyethanol",False
CLINIQUE,CLINIQUE Acne Solutions BB Cream Broad Spectrum SPF 40,"Octinoxate 7.5% , Octisalate 2.0% , Titanium Dioxide 1.6%Water , Methyl Trimethicone , Alcohol , Ethylhexyl Palmitate , Peg-9 Polydimethylsiloxyethyl Dimethicone , Propanediol , Glycerin , Glyceryl Caprylate , Peg-3 Dimethicone , Dimethicone , Tocopheryl Acetate , Lecithin , Triethoxycaprylylsilane , Stearyl Glycyrrhetinate , Sorbitan Sesquiisostearate , Sodium Hyaluronate , Pyridoxine Hcl , Stearic Acid , Hesperidin Methyl Chalcone , Palmitoyl Tetrapeptide-7 , Sodium Chloride , Aluminum Hydroxide , Steareth-20 , Dipeptide-2 , Silica , Sodium Citrate , Phenoxyethanol , [+/- Mica , Iron Oxides (Ci 77491) , Iron Oxides (Ci 77492) , Iron Oxides (Ci 77499) , Titanium Dioxide (Ci 77891)]",False
SHISEIDO,SHISEIDO Benefiance WrinkleResist24 Night Emulsion,"Water, Glycerin, Dipropylene Glycol, Pentaerythrityl Tetraethylhexanoate, Mineral Oil (Paraffinum Liquidum), Dimethicone, Sd Alcohol 40-B (Alcohol Denat.), Petrolatum, Hydrogenated Polydecene, Glyceryl Stearate Se, Behenyl Alcohol, Peg-6, Peg-32, Squalane, Peg-5 Glyceryl Stearate, Phenoxyethanol, Stearic Acid, Isostearic Acid, Behenic Acid, Fragrance (Parfum), Microcrystalline Wax (Cera Microcristallina), Carbomer, Peg/Ppg-17/4 Dimethyl Ether, Phytosteryl Macadamiate, Alcohol, Potassium Hydroxide, Tocopheryl Acetate, Dipotassium Glycyrrhizate, Butylene Glycol, Disodium Edta, Butylphenyl Methylpropional, Sodium Metaphosphate, Limonene, Linalool, Sapindus Mukurossi Peel Extract (Sapindus Mukurossi), Citronellol, Alpha-Isomethyl Ionone, Geraniol, Benzyl Benzoate, Hexyl Cinnamal, Uncaria Gambir Extract (Uncaria Gambir), Sodium Acetylated Hyaluronate, Hydroxyproline, Hypericum Erectum Extract, Iron Oxides (Ci 77491), Chlorella Vulgaris Extract, Tocopherol.",False
LANCÔME,LANCÔME ABSOLUE PREMIUM ßx – Absolute Replenishing Cream SPF 15 Sunscreen,No Info,False
MURAD,MURAD Essential-C Day Moisture Broad Spectrum SPF 30 PA+++,"Water, Butylene Glycol, Stearic Acid, Diisopropyl Sebacate, Cocoglycerides, Lauryl Lactate, Glyceryl Stearate, PEG-100 Stearate, Isodecyl Neopentanoate, Dimethicone, Cetyl Alcohol, Cetyl Phosphate, Urea, Yeast Amino Acids, Trehalose, Inositol, Taurine, Betaine, Phospholipids, Retinyl Palmitate, Tocopheryl Acetate, Ascorbyl Palmitate, Pelvetia Canaliculata Extract, Ectoin, Ginkgo Biloba Leaf Extract, Grape Seed Extract, Passiflora Incarnata Extract, Tetrahexyldecyl Ascorbate, Sodium PCA, Panthenol, Tripleurospermum Maritimum Extract, Zinc Gluconate, Ethyl Linoleate, Magnesium Aluminum Silicate, Xanthan Gum, Aminomethyl Propanol, Disodium EDTA, Phenoxyethanol, Caprylyl Glycol, Chlorphenesin, Limonene*, Linalool *, Fragrance, Yellow 6 (CI 15985), Red 33 (CI 17200). *Allergen.",False
CLINIQUE,CLINIQUE Moisture Surge CC Cream Hydrating Colour Corrector Broad Spectrum SPF 30,"Water, Squalane, Octyldodecyl Neopentanoate, Butylene Glycol, Propanediol, Glyceryl Stearate, Behenyl Alcohol, Peg-40 Stearate, Polyglyceryl-10 Pentastearate, Aloe Barbadensis Leaf Water, Thermus Thermophillus Ferment, Trehalose, Caffeine, Glycerin, Linoleic Acid, Lecithin, Stearic Acid, Hydrogenated Lecithin, Sorbitol, Polyglyceryl-6 Polyricinoleate, Tocopheryl Acetate, Ammonium Acryloyldimethyltaurate/Vp Copolymer, Sodium Stearoyl Lactylate, Sodium Hyaluronate, Tetrahexyldecyl Ascorbate, Pentaerythrityl Tetra-Di-T-Butyl Hydroxyhydrocinnamate, Isopropyl Titanium Triisostearate, Synthetic Fluorphlogopite, Xanthan Gum, Silica, Alumina, Sodium Dehydroacetate, Tin Oxide, Disodium Edta, Phenoxyethanol, [+/- Mica, Titanium Dioxide (Ci 77891), Iron Oxides (Ci 77492), Iron Oxides (Ci 77491), Iron Oxides (Ci 77499)].",False
SHISEIDO,SHISEIDO Future Solution LX Total Regenerating Cream,"Dipropylene Glycol, Glycerin, Dimethicone, Butylene Glycol, Xylitol, Piperidinepropionic Acid, Petrolatum, Mineral Oil(Paraffinum Liquidum/Huile Minerale), Diisostearyl Malate, Myristyl Myristate, Pentaerythrityl Tetrabehenate/Benzoate/Ethylhexanoate, Behenyl Alcohol, Glyceryl Stearate Se, Stearyl Alcohol, Pentaerythrityl Tetraethylhexanoate, Batyl Alcohol, Dimethicone Crosspolymer, Beheneth-20, Phenoxyethanol, Dimethylacrylamide/Sodium Acryloyldimethyltaurate Crosspolymer, Fragrance, Sorbitan Tristearate, Sodium Methyl Stearoyl Taurate, Peg/Ppg-17/4 Dimethyl Ether, Tocopheryl Acetate, Sodium Citrate, Bht, Xanthan Gum, Trisodium Edta, Sodium Metabisulfite, Linalool, Citric Acid, Sodium Metaphosphate, Iron Oxides (Ci 77492), Phytosteryl/Octyldodecyl Lauroyl Glutamate, Butylphenyl Methylpropional, Alcohol, Limonene, 2-O-Ethyl Ascorbic Acid, Alpha-Isomethyl Ionone, Citronellol, Geraniol, Benzyl Benzoate, Prunus Speciosa Leaf Extract, Angelica Acutiloba Root Extract, Iron Oxides (Ci 77491), Sanguisorba Officinalis Root Extract, Isodonis Japonicus Leaf/Stalk Extract, Camellia Sinensis Leaf Extract, Tocopherol.",False
SHISEIDO,SHISEIDO Ibuki Refining Moisturizer,"Water Glycerin, Butylene Glycol, Dipropylene Glycol, Hydrogenated Polydecene, Triethylhexanoin, Hdi/Trimethylol Hexyllactone Crosspolymer, Dimethicone, Glyceryl Stearate Se, Trehalose, Peg-5 Glyceryl Stearate, Behenyl Alcohol, Phenoxyethanol, Stearic Acid, Isostearic Acid, Behenic Acid, Alcohol, Carbomer, Aminopropyl Dimethicone, Betaine, Fragrance, Silica, Potassium Hydroxide, Glycyl Glycine, Sodium Metabisulfite, Disodium Edta, Limonene, Hexyl Cinnamal, Butylphenyl Methylpropional, Benzyl Benzoate, Linalool, Paeonia Albiflora Root Extract, Witch Hazel Leaf Extract, Lamium Album Flower Extract, Citrus Junos Seed Extract, Tocopherol, Zingiber Aromaticus Extract, Benzoic Acid.",False
SHISEIDO,SHISEIDO Ibuki Refining Moisturizer Enriched,"Water, Glycerin, Cetyl Ethylhexanoate, Butylene Glycol, Dimethicone, Xylitol, Hydrogenated Polydecene, Methyl Methacrylate Crosspolymer, Peg-60 Glyceryl Isostearate, Alcohol Denat., Stearyl Alcohol, Petrolatum, Glyceryl Stearate, Behenyl Alcohol, Trehalose, Peg-10 Dimethicone, Titanium Dioxide (Ci 77891), Dimethicone Crosspolymer, Silica, Hydrogenated Palm Oil, Phenoxyethanol, Mica, Elaeis Guineensis (Palm) Kernel Oil, Elaeis Guineensis (Palm) Oil, Methylparaben, Alcohol, Fragrance (Parfum), Betaine, Sodium Citrate, Glycyl Glycine, Tin Oxide, Disodium Edta, Acrylates/C10-30 Alkyl Acrylate Crosspolymer, Limonene, Citric Acid, Hexyl Cinnamal, Butylphenyl Methylpropional, Benzyl Benzoate, Linalool, Sodium Polyacrylate, Paeonia Albiflora Root Extract, Hamamelis Virginiana (Witch Hazel) Leaf Extract, Citronellol, Lamium Album Flower Extract, Citrus Junos Seed Extract, Potassium Hydroxide, Tocopherol, Zingiber Aromaticus Extract, Benzoic Acid.",False
LA MER,LA MER The Renewal Oil Mini,"Limnanthes Alba (Meadowfoam) Seed Oil, Dimethicone, Caprylic/Capric Triglyceride, Water, Trisiloxane, Prunus Amygdalus Dulcis (Sweet Almond) Oil, Simmondsia Chinensis (Jojoba) Seed Oil, Polydecene, Hydrogenated Polydecene, Butylene Glycol, Propanediol, Glycerin, Algae (Seaweed) Extract, Brassica Campestris (Rapeseed) Seed Oil, Helianthus Annuus (Sunflower) Seed Oil, Sesamum Indicum (Sesame) Seed Oil, Eucalyptus Globulus (Eucalyptus) Leaf Oil, Camelina Sativa Seed Oil, Oxycoccus Palustris (Cranberry) Seed Oil, Olea Europaea (Olive) Fruit Oil, Hippophae Rhamnoides Oil, Medicago Sativa (Alfalfa) Seed Powder, Helianthus Annuus (Sunflower) Seedcake, Prunus Amygdalus Dulcis (Sweet Almond) Seed Meal, Sodium Gluconate, Copper Gluconate, Calcium Gluconate, Magnesium Gluconate, Zinc Gluconate, Tocopheryl Succinate, Niacin, Sesamum Indicum (Sesame) Seed Powder, Laminaria Ochroleuca Extract, Laminaria Saccharina Extract, Hydrolyzed Algin, Sea Salt/Maris Sal/Sel Marin, Chlorella Vulgaris Extract, Salicornia Herbacea Extract, Sigesbeckia Orientalis (St. Paul'S Wort) Extract, Laminaria Digitata Extract, Rosmarinus Officinalis (Rosemary) Leaf Extract, Magnolia Officinalis Bark Extract, Yeast Extract/Faex/Extrait De Levure, Crithmum Maritimum Extract, Commiphora Mukul Resin Extract, Citrus Aurantifolia (Lime) Peel Extract, Molasses Extract/Saccharum Officinarum/Extrait De Melasse, Sucrose, Acetyl Hexapeptide-8, Acetyl Glucosamine, Caffeine, Tocopheryl Acetate, Phenyl Trimethicone, Sodium Chloride, Tetrahexyldecyl Ascorbate, Alcohol Denat., Fragrance, Hexyl Cinnamal, Linalool, Amyl Cinnamal, Geraniol, Limonene, Citral, Benzyl Benzoate, Coumarin, Citronellol, Bht, Phenoxyethanol, Yellow 5 (Ci 19140), Yellow 6 (Ci 15985)",False
LANCÔME,LANCÔME BIENFAIT MULTI-VITAL NIGHT - High Potency Night Moisturizing Cream VITA-NUTRI 8™,"Water, Dimethicone, Hydrogenated Polyisobutene, Mineral Oil, Glycerin, Cetyl Alcohol, Butylene Glycol, Peg-100 Stearate, Glyceryl Stearate, Rice Bran Oil, Corn Oil, Hydroxyethylpiperazine Ethane Sulfonic Acid, Yellow 6, Yellow 5, C13-14 Isoparaffin, Tocopheryl Acetate, Tocopherol, Ascorbyl Glucoside, Hydroxycitronellal, Phenoxyethanol, Magnesium Aspartate, Wheat Germ Oil, Polyacrylamide, Chlorhexidine Digluconate, Polycaprolactone, Panthenol, Pentaerythrityl Tetra-Di-T-Butyl Hydroxyhydrocinnamate, Benzyl Salicylate, Benzyl Alcohol, Linalool, Zinc Gluconate, Caprylyl Glycol, Alpha-Isomethyl Ionone, Copper Gluconate, Sorbitan Tristearate, Microcrystalline Wax, Paraffin, Sesame Seed Oil, Retinyl Palmitate, Butylphenyl Methylpropional, Laureth-7, Hexyl Cinnamal, Soybean Oil, Fragrance.",False
ESTÉE LAUDER,ESTÉE LAUDER Advanced Time Zone Night Age Reversing Line/Wrinkle Crème,"Adv Timezone Night Age Rvr Lw Crm Division: El (Estee Lauder)Ingredients: Water , Bis-Diglyceryl Polyacyladipate-2 , Hdi/Ppg/Polycaprolactone Crosspolymer , Simmondsia Chinensis (Jojoba) Seed Oil , Glycerin , Caprylic/Capric Triglyceride , C12-20 Acid Peg-8 Ester , Dimethicone , Butylene Glycol , Sucrose , Cetyl Alcohol , Citrullus Vulgaris (Watermelon) Fruit Extract , Sigesbeckia Orientalis (St. Paul'S Wort) Extract , Pyrus Malus (Apple) Fruit Extract , Lens Esculenta (Lentil) Fruit Extract , Centaurium Erythraea (Centaury) Extract , Hordeum Vulgare (Barley) Extract/Extrait D'Orge , Cucumis Sativus (Cucumber) Fruit Extract , Tamarindus Indica Seed Extract , Salicornia Herbacea Extract , Polygonum Cuspidatum Root Extract , Vitis Vinifera (Grape) Seed Extract , Hydrolyzed Rice Extract , Rosmarinus Officinalis (Rosemary) Extract , Selaginella Tamariscina (Spike Moss) Extract , Humulus Lupulus (Hops) Extract , Citrus Reticulata (Tangerine) Peel Extract , Rhodochrosite Extract , Cucumis Melo (Melon) Fruit Extract , Yeast Extract/Faex/Extrait De Levure , Limonium Vulgare Flower/Leaf/Stem Extract , Whey Protein/Lactis Protein/Proteine Du Petit-Lait , Thermus Thermophillus Ferment , Persea Gratissima (Avocado) Oil , Punica Granatum (Pomegranate) Fruit Juice , Cholesterol , Linoleic Acid , Caffeine , Acetyl Glucosamine , Linolenic Acid , Adenosine Phosphate , Phospholipids , Acetyl Hexapeptide-8 , Ammonium Acryloyldimethyltaurate/Vp Copolymer , Behenyl Alcohol , Saccharide Isomerate , Peg-100 Stearate , Phytosterols , Tocopheryl Acetate , Triolein , Glyceryl Stearate , Trehalose , Potassium Cetyl Phosphate , Caprylyl Glycol , Propylene Glycol Dicaprate , Sodium Pca , Helianthus Annuus (Sunflower) Seedcake , Propylene Glycol Dicaprylate , Xanthan Gum , Acrylates/C10-30 Alkyl Acrylate Crosspolymer , Sodium Hyaluronate , Sodium Lactate , Dipalmitoyl Hydroxyproline , Phytosteryl Canola Glycerides , Oleic Acid , Palmitic Acid , Stearic Acid , Potassium Sulfate , Acrylamide/Sodium Acryloyldimethyltaurate Copolymer , Decarboxy Carnosine Hcl , Isohexadecane , Nordihydroguaiaretic Acid , Carbomer , Polysorbate 80 , Cyclodextrin , Fragrance , Silica , Ethylbisiminomethylguaiacol Manganese Chloride , Sodium Hydroxide , Phenoxyethanol , Red 33 (Ci 17200) , Blue 1 (Ci 42090)",False
SHISEIDO,SHISEIDO White Lucent MultiBright Night Cream,Visit the Shiseido boutique,False
CLINIQUE,CLINIQUE Limited Edition Dramatically Different™ Moisturizing Gel,"Water, Dimethicone, Isododecane, Butylene Glycol, Bis-Peg-18 Methyl Ether Dimethyl Silane, Glycerin, Laminaria Saccharina Extract, Polygonum Cuspidatum Root Extract, Saccharomyces Lysate Extract, Cucumis Sativus (Cucumber) Fruit Extract, Hordeum Vulgare (Barley) Extract/Extrait D'Orge, Helianthus Annuus (Sunflower) Seedcake, Caffeine, Trehalose, Sodium Hyaluronate, Tocopheryl Acetate, Chamomilla Recutita (Matricaria), Polysilicone-11, Silica, Propylene Glycol Dicaprate, Oleth-10, Lactobacillus Ferment, Laureth-23, Laureth-4, Ammonium Acryloyldimethyltaurate/Vp Copolymer, Carbomer, Caprylyl Glycol, Hexylene Glycol, Tromethamine, Disodium Edta, Phenoxyethanol, Potassium Sorbate, Yellow 5 (Ci 19140), Red 4 (Ci 14700), Yellow 6 (Ci 15985).",False
SHISEIDO,SHISEIDO Bio-Performance Glow Revival Cream,"Water, Dipropylene Glycol, Dimethicone, Glycerin, Sd Alcohol 40-B (Alcohol Denat.), Triethylhexanoin, Diphenylsiloxy Phenyl Trimethicone, Hydrogenated Polydecene, Phytosteryl Macadamiate, Dimethicone Crosspolymer, Microcrystalline Wax(Cera Microcristallina/Cire Microcristalline), Behenyl Alcohol, Glyceryl Stearate Se, Talc, Trehalose, Peg/Ppg-14/7 Dimethyl Ether, Hydrogenated Polyisobutene, Methyl Methacrylate Crosspolymer, Stearyl Alcohol, Dimethylacrylamide/Sodium Acryloyldimethyltaurate Crosspolymer, Polysorbate 60, Peg-40 Stearate, Phenoxyethanol, Mica, Titanium Dioxide (Ci 77891), Sorbitan Tristearate, Disodium Edta, Tocopheryl Acetate, Caffeine, Sodium Citrate, Fragrance (Parfum), 2-O-Ethyl Ascorbic Acid, Silica, Butylene Glycol, Sodium Metaphosphate, Limonene, Citric Acid, Xylitol, Oryzanol, Magnesium Ascorbyl Phosphate, Alcohol, Hexyl Cinnamal, Benzyl Benzoate, Butylphenyl Methylpropional, Linalool, Sodium Metabisulfite, Sodium Acetylated Hyaluronate, Iron Oxides (Ci 77491), Alpha-Isomethyl Ionone, Saccharomyces Ferment Lysate Filtrate, Crataegus Monogyna Flower Extract, Citronellol, Geraniol, Dipotassium Glycyrrhizate, Tocopherol, Paeonia Suffruticosa Root Extract, Rehmannia Chinensis Root Extract, Cinnamomum Cassia Bark Extract, Bupleurum Falcatum Root Extract, Camellia Sinensis Leaf Extract.",False
SEPHORA COLLECTION,SEPHORA COLLECTION Sleeping Mask,"Water, Butylene Glycol, Glycerin, Betaine, Phenoxyethanol, Acrylates/C10-30 Alkyl Acrylate Crosspolymer, Tremella Fuciformis (Mushroom) Extract, Ethylhexylglycerin, Sodium Hydroxide, Barosma Betulina Leaf Extract, Peg-40 Hydrogenated Castor Oil, Sodium Hyaluronate, Fragrance, Camellia Sinensis Leaf Extract, Citric Acid, Linalool, Potassium Sorbate, Sodium Benzoate, CI 19140 (Yellow 5), CI 42090 (Blue 1).",False
ESTÉE LAUDER,"ESTÉE LAUDER Resilience Lift Firming/Sculpting Face and Neck Creme Broad Spectrum SPF 15, Normal/Combination Skin","Res Lift Firm/Sclp Face Nc Spf15 Division: El (Estee Lauder)Active Ingredients: Avobenzone 3.00% , Octisalate 5.00% , Octocrylene 2.70%Ingredients: Water , Neopentyl Glycol Diheptanoate , Cetyl Alcohol , Pentaerythrityl Tetraethylhexanoate , Glycerin , Polyethylene , Butyloctyl Salicylate , Di-C12-15 Alkyl Fumarate , Petrolatum , Hydrogenated Lecithin , Butylene Glycol , Propanediol , Hydrogenated Polyisobutene , Octyldodecyl Myristate , Hexyldecyl Stearate , Dimethicone , Glyceryl Stearate , Laminaria Digitata Extract , Behenyl Alcohol , Algae Extract , Persea Gratissima (Avocado) Oil , Coleus Barbatus Extract , Cucumis Melo (Melon) Fruit Extract , Potato Starch Modified , Mimosa Tenuiflora Bark Extract , Yeast Extract/Faex/Extrait De Levure , Plankton Extract , Aminopropyl Ascorbyl Phosphate , Thermus Thermophillus Ferment , Saccharomyces Ferment Lysate Filtrate , Artemia Extract , C12-16 Alcohols , Acetyl Glucosamine , Linoleic Acid , Whey Protein/Lactis Protein/Proteine Du Petit-Lait , Peg-100 Stearate , Tocopheryl Acetate , Caffeine , Ergothioneine , Glycine Soja (Soybean) Sterols , Decarboxy Carnosine Hcl , Palmitic Acid , Creatine , Ethylhexylglycerin , Polymethyl Methacrylate , Trehalose , Glucose , Sodium Hyaluronate , Sorbitol , Zinc Pca , Cholesterol , Malachite , Acetyl Hexapeptide-8 , Maltodextrin , Lecithin , Acrylamide/Sodium Acryloyldimethyltaurate Copolymer , Isohexadecane , Sodium Hydroxide , Polysorbate 80 , Lactoperoxidase , Hexylene Glycol , Hydrogenated Starch Hydrolysate , Potassium Sulfate , Glucose Oxidase , Polysilicone-11 , Propylene Glycol Dicaprylate , Xanthan Gum , Caprylyl Glycol , Citric Acid , Fragrance , Bht , Disodium Edta , Phenoxyethanol , Potassium Sorbate , Mica , Titanium Dioxide (Ci 77891) , Red 4 (Ci 14700) , Yellow 5 (Ci 19140)",False
ESTÉE LAUDER,ESTÉE LAUDER Resilience Lift Night Lifting/Firming Face and Neck Creme,Visit the Estée Lauder boutique,False
CLINIQUE,CLINIQUE Moisture Surge Hydrating Supercharged Concentrate,"Water , Glycerin , Butylene Glycol , Phenyl Trimethicone , Propanediol , Sucrose , Hydroxyethyl Urea , Alteromonas Ferment Extract , Hydrolyzed Rice Extract , Acetyl Glucosamine , Trehalose , Algae Extract , Caffeine , Cholesterol , Aloe Barbadensis Leaf Water , Sodium Hyaluronate , Pentaerythrityl Tetraethylhexanoate , Dextrin Palmitate , Acrylates/C10-30 Alkyl Acrylate Crosspolymer , Sorbitol , Sodium Polyaspartate , Tocopheryl Acetate , Carbomer , Dehydroxanthan Gum , Citric Acid , Tetrahexyldecyl Ascorbate , Benzophenone-4 , Pentaerythrityl Tetra-Di-T-Butyl Hydroxyhydrocinnamate , Sodium Hydroxide , Sodium Citrate , Disodium Edta , Bht , Chlorphenesin , Phenoxyethanol , Red 4 (Ci 14700) , Yellow 5 (Ci 19140)",False
KIEHL'S SINCE 1851,KIEHL'S SINCE 1851 Ultra Facial Overnight Hydrating Mask,"Water Glycerin, Propylene Glycol, Squalane, Shea Butter, Triethanolamine, Carbomer, Urea, Dimethicone, Hydroxyethylpiperazine Ethane Sulfonic Acid, Phenoxyethanol, Caprylyl Glycol, Imperata Cylindrica Root Extract, Ophiopogon Japonicus Root Extract, Sodium Citrate, Citric Acid, Aluminum Starch Octenylsuccinate, Chlorphenesin, Pseudoalteromonas Ferment Extract, Disodium Edta, Acrylates/C10-30 Alkyl Acrylate Crosspolymer.",False
