Product Brand,Product Name,Ingredients,Clean Product
KIEHL'S SINCE 1851,KIEHL'S SINCE 1851 Ultra Facial Cleanser,"Water, Sodium Laureth Sulfate, Decyl Glucoside, Glycerin, Cocamidopropyl Betaine, Disodium Cocoamphodiacetate, Acrylates Copolymer, Peg-200 Hydrogenated Glyceryl Palmate, Lauryl Glucoside, Sodium Chloride, Pentylene Glycol, Triethanolamine, Phenoxyethanol, Peg-7 Glyceryl Cocoate, Distearyl Ether, Behenyl Alcohol, Methylparaben, Laureth-2, Propylparaben, Sodium Methylparaben, Squalane, Sweet Almond Oil, Apricot Kernel Oil, Tocopherol, Ascorbyl Glucoside, Avocado Oil, Sodium Hydroxide, Citric Acid.",False
KIEHL'S SINCE 1851,KIEHL'S SINCE 1851 Ultra Facial Toner,"Water, Glycerin, Squalane, Phenoxyethanol, Acrylates/C10-30 Alkyl Acrylate Crosspolymer, Sorbitan Oleate, Ethylhexyl Salicylate, Peg-100 Stearate, Potassium Sorbate, Triethanolamine, P-Anisic Acid, Ascorbyl Glucoside, Sodium Hyaluronate, Prunus Amygdalus Dulcis Oil, Sweet Almond Oil, Prunus Armeniaca Kernel Oil, Apricot Kernel Oil, Tocopherol, Persea Gratissima Oil, Avocado Oil.",False
SEPHORA COLLECTION,SEPHORA COLLECTION Cleansing & Exfoliating Wipes - Coconut Water,No Info,False
PETER THOMAS ROTH,PETER THOMAS ROTH Anti-Aging Cleansing Gel,"Water, Sodium Laureth Sulfate, Cocamidopropyl Betaine, Lauryl Glucoside, Propylene Glycol, Salicylic Acid, Glycolic Acid, Quercus Alba Bark Extract, Citrus Grandis (Grapefruit) Fruit Extract, Prunus Persica (Peach) Fruit Extract, Citrus Aurantifolia (Lime) Fruit Extract, Citrus Limon (Lemon) Fruit Extract, Arginine, Tilia Cordata Flower Extract, Allantoin, Bht, Panthenol, Butylene Glycol, Potassium Sorbate, Sodium Benzoate, Phenoxyethanol, Amyl Cinnamal, Linalool, Fragrance, Red 40 (Ci 16035), Yellow 5 (Ci 19140).",False
MURAD,MURAD Clarifying Cleanser,"Water, Cocamidopropyl Betaine, Sodium C14-16 Olefin Sulfonate, Methyl Gluceth-20, PPG-26-Buteth-26, PEG-40 Hydrogenated Castor Oil, Butylene Glycol, Cimicifuga Racemosa Root Extract, Camellia Oleifera Leaf Extract, Silver Citrate, Menthol, PEG-150 Distearate, Corn Starch, Hydrolyzed Corn Starch, Hydrolyzed Corn Starch Octenylsuccinate, Glyceryl Stearate, Cocamidopropyl Dimethylamine, Polysorbate 80, Citric Acid, Tetrasodium EDTA, Chlorphenesin, Methylisothiazolinone, Limonene, Tangerine Leaf Oil, Citronella Oil, Lemon Peel Oil, Lime Oil, Lavandula Hybrida Oil, Mandarin Orange Peel Oil, Apricot Kernel Oil, Fragrance.",False
LA MER,LA MER The Tonic,"Declustered Water (-)/Aqua/Eau De-Structuree (-), Methyl Gluceth-20, Glycereth-26, Laminaria Saccharina Extract, Algae (Seaweed) Extract, Sesamum Indicum (Sesame) Seed Oil, Medicago Sativa (Alfalfa) Seed Powder, Helianthus Annuus (Sunflower) Seedcake, Prunus Amygdalus Dulcis (Sweet Almond) Seed Meal, Eucalyptus Globulus (Eucalyptus) Leaf Oil, Sodium Gluconate, Copper Gluconate, Calcium Gluconate, Magnesium Gluconate, Zinc Gluconate, Tocopheryl Succinate, Niacin, Sesamum Indicum (Sesame) Seed Powder, Butylene Glycol, Ppg-28-Buteth-35, Ppg-5-Ceteth-20, Sodium Hyaluronate, Citric Acid, Sodium Citrate, Polysorbate 20, Sucrose, Caffeine, Disodium Edta, Benzophenone-4, Phenoxyethanol, Potassium Sorbate, Fragrance, Linalool, Yellow 5 (Ci 19140), Red 33 (Ci 17200)",False
ESTÉE LAUDER,ESTÉE LAUDER Nutritious Radiant Vitality Energy Lotion,"Nutritious Vitality8 Egy Lot Int M Division: El (Estee Lauder)Ingredients: Water , Alcohol Denat. , Glycerin , Dipropylene Glycol , Propanediol , Trehalose , Citrullus Vulgaris (Watermelon) Fruit Extract , Lens Esculenta (Lentil) Fruit Extract , Pyrus Malus (Apple) Fruit Extract , Cucumis Sativus (Cucumber) Fruit Extract , Panax Ginseng (Ginseng) Root Extract , Vaccinium Macrocarpon (Cranberry) Fruit Extract , Vaccinium Angustifolium (Blueberry) Fruit Extract , Lycium Chinense (Wolfberry) Fruit Extract , Punica Granatum (Pomegranate) Extract , Acetyl Glucosamine , Sodium Pca , Sapindus Mukurossi Fruit Extract , Algae Extract , Garcinia Mangostana Peel Extract , Caesalpinia Spinosa Gum , Ergothioneine , Caffeine , Yeast Extract/Faex/Extrait De Levure , Sodium Lactate , Sodium Hyaluronate , Peg-8 , Ppg-6-Decyltetradeceth-30 , Butylene Glycol , Tromethamine , Tocopheryl Acetate , Tetrahexyldecyl Ascorbate , Carbomer , Citric Acid , Fragrance , Trisodium Hedta , Phenoxyethanol , Yellow 6 (Ci 15985) , Red 4 (Ci 14700)",False
MURAD,MURAD AHA/BHA Exfoliating Cleanser,"Water, Sodium Laureth Sulfate, Cocamidopropyl Betaine, Jojoba Esters, Acrylates Copolymer, Glycol Stearate, Butylene Glycol, Sodium PCA, Dipotassium Glycyrrhizate, Sodium Ascorbyl Phosphate, Glycolic Acid, Lactic Acid, Salicylic Acid, Polyquaternium-4, Sodium Hydroxide, Sodium Chloride, Citric Acid, Disodium EDTA, Phenoxyethanol, Methylparaben, Propylparaben.",False
DR. JART+,DR. JART+ Ceramidin™ Liquid,"Water, Dipropylene Glycol, Alcohol, Betaine, Propanediol, Glycosyl Trehalose, 1,2-Hexanediol, Erythritol, Pentylene Glycol, Glycerin, Hydrogenated Starch Hydrolysate, Acrylates/C10-30 Alkyl Acrylate Crosspolymer, Triethylhexanoin, Diphenyl Dimethicone, Triethylhexanoin, Panthenol, Butylene Glycol, Hydrogenated Lecithin, Centella Asiatica Extract, Icus Carica (Fig) Fruit Extract, Melia Azadirachta Leaf Extract, Theobroma Cacao (Cocoa) Seed Extract, Amaranthus Caudatus Seed Extract, Ulmus Davidiana Root Extract, Curcuma Longa (Turmeric) Root Extract, Ocimum Sanctum Leaf Extract, Corallina Officinalis Extract, Pyracantha Fortuneana Fruit Extract, Carbomer, Cellulose Gum, Sucrose Distearate, Dipotassium Glycyrrhizate, Ethylhexylglycerin, Methylpropanediol, Disodium Edta, Glyceryl Polymethacrylate, Citrus Aurantium Bergamia (Bergamot) Fruit Oil, C12-14 Pareth-12, Polyglyceryl-10 Myristate, Pelargonium Graveolens Flower Oil, Dextrin, Glyceryl Stearate, Sodium Hyaluronate, Salvia Officinalis (Sage) Oil, Pogostemon Cablin Oil, Cholesterol, Ceramide EOP, Ceramide AP, Ceramide AS, Ceramide NS.",False
MURAD,MURAD Time Release Acne Cleanser,"Water, Disodium Cocoamphodiacetate, Glycerin, Cetyl Alcohol, Cocamidopropyl Betaine, Cetearyl Alcohol, Sodium Cocoyl Isethionate, PEG-100 Stearate, Glyceryl Stearate, Butylene Glycol, Sodium Hyaluronate, Tocopheryl Acetate, Caprylic/Capric Triglyceride, Retinol, Salix Alba (Willow) Bark Extract, Ascorbic Acid, Chitosan, Silver Citrate, Sodium PCA, Betaine, Sorbitol, Glycine, Alanine, Proline, Serine, Threonine, Arginine, Lysine, Glutamic Acid, Zinc Gluconate, Argania Spinosa Kernel Extract, Serenoa Serrulata Fruit Extract, Sesamum Indicum (Sesame) Seed Extract, Cimicifuga Racemosa Root Extract, Melaleuca Alternifolia (Tea Tree) Leaf Oil, Cocamidopropyl Dimethylamine, Zea Mays (Corn) Starch, Hydrolyzed Corn Starch, Hydrolyzed Corn Starch Octenylsuccinate, Citric Acid, Disodium EDTA, Propyl Gallate, Polysorbate 80, Menthol, Cetearyl Glucoside, Glycol Distearate, Steareth-4, PEG-150 Distearate, Hydroxyethylcellulose, Polyacrylate-13, Polyisobutene, Polysorbate 20, Trisodium Ethylenediamine Disuccinate, Phenoxyethanol, Caprylyl Glycol, Chlorphenesin, Fragrance.",False
KIEHL'S SINCE 1851,KIEHL'S SINCE 1851 Rare Earth Deep Pore Daily Cleanser,"Water, Kaolin, Glycerin, Alcohol Denat., Sodium Cocoyl Glycinate, Coco-Betaine, Acrylates Copolymer, Sodium Chloride, Ci 77891, Titanium Dioxide, Solum Diatomeae, Diatomaceous Earth, Phenoxyethanol, Peg-14m, Glycol Distearate, Sodium Benzoate, Aloe Barbadensis, Aloe Barbadensis Leaf Juice, Salicylic Acid, Avena Sativa Flour, Oat Kernel Flour, Tocopherol, Sodium Hydroxide, Allantoin.",False
KIEHL'S SINCE 1851,KIEHL'S SINCE 1851 Midnight Recovery Botanical Cleansing Oil,"-Essential Oil Blend and Lavender Essential Oil: Soothe redness and reduce skin blotchiness for a more even, brighter look. -Evening Primrose Oil: Boosts radiance.",False
LANCÔME,LANCÔME Crème Radiance Gentle Cleansing Creamy-Foam Cleanser,"Glycerin, Water, Myristic Acid, Stearic Acid, Potassium Hydroxide, Palmitic Acid, Glyceryl Stearate Se, Lauric Acid, Coco-Glucoside, Glycol Distearate, Fragrance, P-Anisic Acid, Tocopherol, Peg-14m, Nelumbo Nucifera Flower Extract, Limonene, Benzyl Salicylate, Linalool, Benzyl Alcohol, Propylene Glycol, Disodium Edta, Rosa Gallica Extract, Butylphenyl Methylpropional, Cryptomeria Japonica Bud Extract.",False
LA MER,LA MER The Cleansing Foam Mini,"Declustered Water (+)/Aqua/Eau De-Structuree (+), Myristic Acid, Glycerin, Behenic Acid, Palmitic Acid, Sodium Methyl Cocoyl Taurate, Potassium Hydroxide, Lauric Acid, Stearic Acid, Algae (Seaweed) Extract, Sesamum Indicum (Sesame) Seed Oil, Medicago Sativa (Alfalfa) Seed Powder, Helianthus Annuus (Sunflower) Seedcake, Prunus Amygdalus Dulcis (Sweet Almond) Seed Meal, Eucalyptus Globulus (Eucalyptus) Leaf Oil, Sodium Gluconate, Copper Gluconate, Calcium Gluconate, Magnesium Gluconate, Zinc Gluconate, Tocopheryl Succinate, Niacin, Sesamum Indicum (Sesame) Seed Powder, Quartz Powder, Nephrite Powder, Pearl Powder, Caffeine, Sea Salt/Maris Sal/Sel Marin, Humic Acids, Sodium Hyaluronate, Sucrose, Tourmaline, Macrocystis Pyrifera (Kelp) Protein, Polyquaternium-51, Aloe Barbadensis Leaf Water, Trehalose, Cellulose, Butylene Glycol, Sodium Coco Pg-Dimonium Chloride Phosphate, Sodium Bicarbonate, Sodium Pca, Peg-3 Distearate, Urea, Fragrance, Disodium Edta, Linalool, Limonene, Phenoxyethanol, Methylchloroisothiazolinone, Methylisothiazolinone, Yellow 5 (Ci 19140), Yellow 6 (Ci 15985), Blue 1 (Ci 42090), Green 5 (Ci 61570)",False
SEPHORA COLLECTION,SEPHORA COLLECTION Cleansing Wipes - Watermelon - Hydrating,No Info,False
MURAD,MURAD Essential-C Cleanser,"Water, Cocamidopropyl Betaine, Disodium Laureth Sulfosuccinate, Glycerin, Butylene Glycol, Aminomethyl Propanol, Polysorbate 20, Acrylates/C10-30 Alkyl Acrylate Crosspolymer, Panthenol, Phospholipids, Tocopheryl Acetate, Retinyl Palmitate, Ascorbyl Palmitate, Ascorbic Acid, Chitosan, Rice Amino Acids, Zinc Aspartate, Allantoin, Sodium PCA, Lactose, Cellulose, Hydroxypropyl Methylcellulose, Propyl Gallate, Disodium EDTA, Phenoxyethanol, Caprylyl Glycol, Chlorphenesin, Limonene, Linalool, Orange Oil, Mandarin Orange Peel Oil, Basil Oil, Grapefruit Peel Oil, Galbanum Resin Oil, Fragrance, Iron Oxides (CI 77492).",False
SEPHORA COLLECTION,SEPHORA COLLECTION Cleansing Wipes - Rose - Moisturizing,No Info,False
LA MER,LA MER The Cleansing Gel,"Declustered Water (+)/Aqua/Eau De-Structuree (+), Cocamidopropyl Hydroxysultaine, Sodium Cocoyl Sarcosinate, Coco-Betaine, Sodium Laureth Sulfate, Sodium Chloride, Aloe Barbadensis Leaf Extract, Avena Sativa (Oat) Kernel Extract, Algae (Seaweed) Extract, Sesamum Indicum (Sesame) Seed Oil, Medicago Sativa (Alfalfa) Seed Powder, Helianthus Annuus (Sunflower) Seedcake, Prunus Amygdalus Dulcis (Sweet Almond) Seed Meal, Eucalyptus Globulus (Eucalyptus) Leaf Oil, Sodium Gluconate, Copper Gluconate, Calcium Gluconate, Magnesium Gluconate, Zinc Gluconate, Tocopheryl Succinate, Niacin, Sesamum Indicum (Sesame) Seed Powder, Butylene Glycol, Sucrose, Caprylyl Glycol, Sodium Bicarbonate, Tourmaline, Hexylene Glycol, Fragrance, Edta, Disodium Edta, Methylchloroisothiazolinone, Methylisothiazolinone, Phenoxyethanol, Alpha-Isomethyl Ionone, Geraniol, Butylphenyl Methylpropional, Linalool, Green 5 (Ci 61570), Yellow 5 (Ci 19140)",False
SEPHORA COLLECTION,SEPHORA COLLECTION Cleansing & Exfoliating Wipes - Green Tea,No Info,False
LANCÔME,LANCÔME MOUSSE RADIANCE Clarifying Self-Foaming Cleanser,Visit the Lancôme boutique,False
SEPHORA COLLECTION,SEPHORA COLLECTION Radiance Cleansing Foam,"Water, Glycerin, Sodium Cocoyl Glycinate, Sorbitol, Cocamidopropyl Betaine, Sodium Laureth Sulfate, PEG-8, Polysorbate 20, Coco-Glucoside, Pullulan, Phenoxyethanol, Potassium Myristate, Potassium Laurate, Caprylyl Glycol, Parfum (Fragrance), Sodium Benzoate, Butylene Glycol, Citric Acid, Cassia Angustifolia Seed Polysaccharide, Sodium Hydroxide, Citrus Medica Limonum (Lemon) Fruit Extract, Citrus Grandis (Grapefruit) Fruit Extract, Citrus Aurantium Dulcis (Orange) Fruit Extract, Hydroxyethylcellulose.",False
SEPHORA COLLECTION,SEPHORA COLLECTION Exfoliating Wipes - Charcoal - Detoxifying,No Info,False
LANCÔME,LANCÔME Cleansing & Clarifying Duo,"Bi-Facil: Water, Cyclopentasiloxane, Isohexadecane, Sodium Chloride, Poloxamer 184, Hexylene Glycol, Dipotassium Phosphate, Benzyl Alochol, Potassium Phosphate, Quaternium-15, Benzalkonium Chloride, Fragrance, Citronellol, Geraniol. Crème Radiance: Glycerin, Water, Myristic Acid, Stearic Acid, Potassium Hydroxide, Palmitic Acid, Glyceryl Stearate Se, Lauric Acid, Coco-Glucoside, Glycol Distearate, Fragrance, P-Anisic Acid, Tocopherol, Peg-14m, Nelumbo Nucifera Flower Extract, Limonene, Benzyl Salicylate, Linalool, Benzyl Alcohol, Propylene Glycol, Disodium Edta, Rosa Gallica Extract, Butylphenyl Methylpropional, Cryptomeria Japonica Bud Extract.",False
DR. JART+,DR. JART+ Dermaclear™ Micro Water,"Water, Butylene Glycol, Dipropylene Glycol, PEG-6 Caprylic/Capric Glycerides, Phenoxyethanol, Decyl Glucoside, PEG-40 Hydrogenated Castor Oil, PPG-26-Buteth-26, Ethylhexylglycerin, Sodium Citrate, Disodium EDTA, Citric Acid, Citrus Aurantium Bergamia (Bergamot) Fruit Oil, Madecassoside, Rice Ferment Filtrate (Sake), Pearl Powder, Galactomyces Ferment Filtrate, Hippophae Rhamnoides Fruit Extract, Sodium Palmitoyl Proline, Salix Nigra (Willow) Bark Extract, Nymphaea Alba Flower Extract, Rosa Multiflora Fruit Extract, Royal Jelly Extract, Caprylyl Glycol.",False
DR. JART+,DR. JART+ Dermaclear™ Micro Foam Cleanser,"Water, Myristic Acid, Sorbitol, Butylene Glycol, Stearic Acid, Potassium Hydroxide, Glycerin, Lauric Acid, Potassium Cocoyl Glycinate, Glycol Distearate, Polysorbate 20, Cocamidopropyl Betaine, Glyceryl Stearate, PEG-32, PEG-7 Glyceryl Cocoate, PEG-100 Stearate, Potassium Cocoate, Polyquaternium-7, Phenoxyethanol, Citrus Aurantium Bergamia (Bergamot) Fruit Oil, Pelargonium Graveolens Flower Oil, Disodium EDTA, Citrus Limon (Lemon) Peel Oil, Ethylhexylglycerin, Olea Europaea (Olive) Fruit Oil, Sodium Benzoate, Panthenol, Salvia Officinalis (Sage) Oil, Dipropylene Glycol, Pogostemon Cablin Oil, Sodium Palmitoyl Proline, Pinus Sylvestris Leaf Oil, Citrus Aurantium Dulcis (Orange) Oil, Citrus Grandis (Grapefruit) Peel Oil, Salvia Sclarea (Clary) Oil, Aniba Rosaeodora (Rosewood) Wood Oil, Rosmarinus Officinalis (Rosemary) Leaf Extract, Nymphaea Alba Flower Extract, Lavandula Angustifolia (Lavender) Oil, Cedrus Atlantica Bark Oil, Eucalyptus Globulus Leaf Oil, Anthemis Nobilis Flower Extract, Copaifera Officinalis (Balsam Copaiba) Resin, Citrus Aurantifolia (Lime) Fruit Extract, Salvia Officinalis (Sage) Leaf Extract, Jasminum Officinale (Jasmine) Oil, Myrtus Communis Oil, Artemisia Absinthium Extract, Rose Flower Oil, Vanilla Planifolia Fruit Extract, Ferula Galbaniflua (Galbanum) Resin Oil.",False
SEPHORA COLLECTION,SEPHORA COLLECTION Diamondbuff by Bee Stunning,Visit the SEPHORA COLLECTION boutique,False
LANCÔME,LANCÔME Tonique Douceur Softening Hydrating Toner with Rose Water,Visit the Lancôme boutique,False
MURAD,MURAD Clarifying Toner,"Water, Witch Hazel Water, Butylene Glycol, Alcohol Denat., PPG-5-Ceteth-20, Carrageenan Extract, Cucumber Fruit Extract, Lemon Fruit Extract, Calendula Officinalis Flower Extract, Lecithin, Tocopherol, Magnesium Ascorbyl Phosphate, Allantoin, Palmitoyl Hydroxypropyltrimonium Amylopectin/Glycerin Crosspolymer, Grape Seed Extract, PEG-12 Dimethicone, Menthol, Menthoxypropanediol, Sodium Hydroxide, Phenoxyethanol, Methylparaben, Citral, Cymbopogon Schoenanthus Oil, Blue 1 (CI 42090), Ext. Violet 2 (CI 60730).",False
SEPHORA COLLECTION,SEPHORA COLLECTION Micellar Cleansing Water & Milk,Visit the SEPHORA COLLECTION boutique,False
SEPHORA COLLECTION,SEPHORA COLLECTION Micellar Cleansing Water & Milk - Pomegranate,No Info,False
SEPHORA COLLECTION,SEPHORA COLLECTION Cleansing Wipes - Cucumber - Anti-fatigue,No Info,False
PETER THOMAS ROTH,PETER THOMAS ROTH 8% Glycolic Solutions Toner,"Water, Glycolic Acid, Alcohol Denat., Methyl Gluceth-20, Propylene Glycol, Hamamelis Virginiana (Witch Hazel) Water, Sodium Hydroxide, Glycerin, Sodium PCA, Aloe Barbadensis Leaf Juice, Allantoin, Camellia Sinensis Leaf Extract, Chamomilla Recutita (Matricaria) Flower Extract, Arginine, Sodium Ascorbyl Phosphate, Lactic Acid, Citric Acid, Polysorbate 20, Butylene Glycol, Potassium Sorbate, Sodium Benzoate, Benzoic Acid, Phenoxyethanol.",False
PETER THOMAS ROTH,PETER THOMAS ROTH Acne Clearing Wash,"Allantoin, BHT, Butyl Methoxydibenzoylmethane, Butylphenyl Methylpropional, Citric Acid, Cocamidopropyl Betaine, Disodium EDTA, Ethylhexyl Methoxycinnamate, Ethylhexyl Salicylate, Fragrance/Parfum, Lauryl Glucoside, Limonene, Linalool, Panthenol, PEG-120 Methyl Glucose Dioleate, PEG-150 Pentaerythrityl Tetrastearate, PEG-40 Hydrogenated Castor Oil, PEG-6 Caprylic/Capric Glycerides, Phenoxyethanol, Potassium Sorbate, PPG-26-Buteth-26, Propylene Glycol, Sodium Benzoate, Sodium Benzotriazolyl Butylphenol Sulfonate, Sodium Chloride, Sodium Citrate, Sodium Hydroxide, Sodium Laureth Sulfate, Tocopherol, Water.",False
MURAD,MURAD Essential-C Toner,"Water, Butylene Glycol, Witch Hazel Water, PEG-40 Hydrogenated Castor Oil, Sodium PCA, Betaine, Sorbitol, Glycine, Alanine, Proline, Serine, Threonine, Arginine, Lysine, Glutamic Acid, Rice Amino Acids, Zinc Aspartate, Dipotassium Glycyrrhizate, PEG-12 Dimethicone, Phospholipids, Tocopheryl Acetate, Retinyl Palmitate, Ascorbyl Palmitate, Ascorbic Acid, Chitosan, Propyl Gallate, Bitter Orange Flower Extract, Echinacea Purpurea Extract, Orange Fruit Extract, Sodium Polyaspartate, Benzophenone-4, Polyquaternium-4, Disodium EDTA, Citric Acid, Phenoxyethanol, Caprylyl Glycol, Chlorphenesin, Limonene, Linalool, Orange Peel Oil, Mandarin Orange Peel Oil, Basil Oil, Grapefruit Peel Oil, Galbanum Resin Oil, Fragrance, Green 3 (CI 42053).",False
MURAD,MURAD Renewing Cleansing Cream,"Water, Sodium Cocoyl Isethionate, Glyceryl Stearate SE, Stearic Acid, Cetyl Alcohol, Glycerin, Prunus Armeniaca (Apricot) Kernel Oil, Urea, Yeast Amino Acids, Trehalose, Inositol, Taurine, Betaine, Echium Plantagineum Seed Oil, Borago Officinalis Seed Oil, Oenothera Biennis (Evening Primrose) Oil, Serenoa Serrulata Fruit Extract, Panthenol, Chondrus Crispus (Carrageenan) Extract, Chamomilla Recutita (Matricaria) Flower Extract , Sodium Hyaluronate, Imperata Cylindrica Root Extract, Sorbitol, Carica Papaya (Papaya) Fruit Extract, Citrus Medica Limonum (Lemon) Fruit Extract, Tocopherol, Ascorbyl Palmitate, Benzophenone-4, Butylene Glycol, Acrylates/C10-30 Alkyl Acrylate Crosspolymer, Carbomer, Xanthan Gum, Phenoxyethanol, Caprylyl Glycol, Chlorphenesin, Limonene, Linalool, Fragrance.",False
PETER THOMAS ROTH,PETER THOMAS ROTH Un-Wrinkle Turbo™ Line Smoothing Toning Lotion,"Water, Glycerin, Palmitoyl Oligopeptide, Palmitoyl Tripeptide-1, Palmitoyl Tripeptide-38, Palmitoyl Tetrapeptide-7, Caprooyl Tetrapeptide-3, Palmitoyl Tripeptide-5, Tripeptide-10 Citrulline, Tetrapeptide-21, Tripeptide-1, Acetyl Octapeptide-3, Palmitoyl Hexapeptide-12, Palmitoyl Dipeptide-10, Acetyl Hexapeptide-30, Acetyl Hexapeptide-8, Pentapeptide-18, Dipeptide Diaminobutyroyl Benzylamide Diacetate, Sodium Hyaluronate, Retinyl Palmitate, Ascorbic Acid, Tocopheryl Acetate, Pseudoalteromonas Ferment Extract, Arginine, Peg-8 Dimethicone, Lecithin, Hydrolyzed Soy Protein, Acetylarginyltryptophyl Diphenylglycine, Sodium Propoxyhydroxypropyl Thiosulfate Silica, Cocamidopropyl Betaine, Octyldodecanol, Sodium Glycolate, Triethanolamine, Sodium Chloride, Cocamidopropyl Dimethylamine, Hydrolyzed Wheat Protein, Carbomer, Acrylates Copolymer, Xanthan Gum, Hydroxypropyl Cyclodextrin, Polysorbate 20, Tin Oxide, Dextran, Butylene Glycol, Silica, Caprylyl Glycol, Potassium Sorbate, Sodium Benzoate, Phenoxyethanol, Mica, Gold (Ci 77480), Titanium Dioxide (Ci 77891), Iron Oxides (Ci 77491).",False
LA MER,LA MER The Cleansing Oil,"Caprylic/Capric Triglyceride, Polysorbate 85, Isononyl Isononanoate, Squalane, C12-15 Alkyl Benzoate, Declustered Water (+)/Aqua/Eau De-Structuree (+), Sorbitan Trioleate, Algae (Seaweed) Extract, Sesamum Indicum (Sesame) Seed Oil, Medicago Sativa (Alfalfa) Seed Powder, Helianthus Annuus (Sunflower) Seedcake, Prunus Amygdalus Dulcis (Sweet Almond) Seed Meal, Eucalyptus Globulus (Eucalyptus) Leaf Oil, Sodium Gluconate, Copper Gluconate, Calcium Gluconate, Magnesium Gluconate, Zinc Gluconate, Tocopheryl Succinate, Niacin, Sesamum Indicum (Sesame) Seed Powder, Laminaria Digitata Extract, Crithmum Maritimum Extract, Chlorella Vulgaris Extract, Vitis Vinifera (Grape) Seed Oil, Sea Salt/Maris Sal/Sel Marin, Pearl Powder, Plankton Extract, Tocopheryl Acetate, Tourmaline, Glycerin, Neopentyl Glycol Dicaprate, Silica, Isopropyl Palmitate, Quaternium-90 Bentonite, Propylene Carbonate, Fragrance, Benzyl Salicylate, Linalool, Butylphenyl Methylpropional, Benzyl Benzoate, Limonene, Alpha-Isomethyl Ionone, Mica, Green 6 (Ci 61565), Violet 2 (Ci 60725), Titanium Dioxide (Ci 77891)",False
MURAD,MURAD Hydrating Toner,"Water, Butylene Glycol, Witch Hazel Water, Urea, Yeast Amino Acids, Trehalose, Inositol, Taurine, Betaine, Carrageenan Extract, Peach Fruit Extract, Anthemis Nobilis Flower Extract, Sodium PCA, Lecithin, Tocopherol, Magnesium Ascorbyl Phosphate, Grape Seed Extract, Cucumber Fruit Extract, PEG-12 Dimethicone, PEG-40 Hydrogenated Castor Oil, Sodium Citrate, Disodium EDTA, Chlorphenesin, Methylisothiazolinone, Benzyl Salicylate, Geraniol, Linalool, Citronellol, Fragrance, Orange 4 (CI 15510), Red 4 (CI 14700).",False
PETER THOMAS ROTH,PETER THOMAS ROTH 3% Glycolic Solutions Cleanser,"Water, Sodium Laureth Sulfate, Propylene Glycol, Glycolic Acid, Cocamidopropyl Betaine, Lauryl Glucoside, Allantoin, Panthenol, Arginine, PEG-6 Caprylic/Capric Glycerides, Sodium Chloride, PEG-150 Pentaerythrityl Tetrastearate, Sodium Hydroxide, Potassium Sorbate, Sodium Benzoate, Phenoxyethanol.",False
PETER THOMAS ROTH,PETER THOMAS ROTH Irish Moor Mud Purifying Cleanser Gel,"Water, Sodium Laureth Sulfate, Glycerin, Cocamidopropyl Betaine, Lauryl Glucoside, Propylene Glycol, Peat, Charcoal Powder, Sargassum Fusiforme Extract, Lava Powder, Salicylic Acid, Lactic Acid, Salix Nigra (Willow) Bark Extract, Allantoin, Panthenol, BHT, Sodium Hydroxide, Xanthan Gum, Melaleuca Alternifolia (Tea Tree) Leaf Oil, Mica, Sodium Benzoate, Potassium Sorbate, Phenoxyethanol.",False
DR. JART+,DR. JART+ Dermaclear™ Trans-Foam Clay Trio,"Water, Titanium Dioxide, Montmorillonite, Sodium Lauryl Sulfate, Glycerin, Palmitic Acid, Stearic Acid, Bentonite, Kaolin, Betaine, Sodium Methyl Cocoyl Taurate, Potassium Hydroxide, Butylene Glycol, Phenoxyethanol, Xanthan Gum, Chlorphenesin, Ethyl Menthane Carboxamide, Ethylhexylglycerin, Cellulose Gum, Tetrasodium Pyrophosphate, Caprylyl Glycol, Menthol, Lauric acid, Myristic Acid, Arachidic Acid, Disodium EDTA, Citrus Aurantium Dulcis (Orange) Peel Oil, Lavandula Angustifolia (Lavender) Oil, Pelargonium Graveolens Flower Oil, Amyris Balsamifera Bark Oil, Eucalyptus Globulus Leaf Oil, Citrus Paradisi (Grapefruit) Peel Oil, Melaleuca Alternifolia (Tea Tree) Leaf Oil, Citrus Aurantium Bergamia (Bergamot) Fruit Oil, Boswellia Carterii Oil, Juniperus Mexicana Oil, Cymbopogon Schoenanthus Extract, Dipropylene Glycol, Decyl Glucoside, Sodium Palmitoyl Proline, Nymphaea Alba Flower Extract.",False
ESTÉE LAUDER,ESTÉE LAUDER Perfectly Clean Multi-Action Toning Lotion/Refiner,"Perfectly Clean Mlt-Act Tng Ltn/Rf Division: El (Estee Lauder)Ingredients: Water , Alcohol Denat. , Glycerin , Butylene Glycol , Hypnea Musciformis (Algae) Extract , Gellidiela Acerosa (Algae) Extract , Hamamelis Virginiana (Witch Hazel) , Silybum Marianum (Lady'S Thistle) Extract , Bambusa Vulgaris (Bamboo) Extract , Pisum Sativum (Pea) Extract , Gentiana Lutea (Gentian) Root Extract , Algae Extract , Oryza Sativa (Rice) Bran Extract , Yeast Extract/Faex/Extrait De Levure , Sucrose , Trehalose , Lactobionic Acid , Peg-40 Hydrogenated Castor Oil , Sorbitol , Caffeine , Dipotassium Glycyrrhizate , Biosaccharide Gum - 1 , Ppg-26-Buteth-26 , Sodium Hyaluronate , Zinc Pca , Pentylene Glycol , Ppg-5-Ceteth-20 , Sodium Hydroxide , Glucosamine Hcl , Fragrance , Phytic Acid , Potassium Sorbate , Disodium Edta , Phenoxyethanol",False
ESTÉE LAUDER,ESTÉE LAUDER Advanced Night Repair Synchronized Recovery Complex II,"Advanced Night Repr Sync Rec Cmp11 Division: El (Estee Lauder)Ingredients: Water , Bifida Ferment Lysate , Methyl Gluceth-20 , Peg-75 , Bis-Peg-18 Methyl Ether Dimethyl Silane , Butylene Glycol , Propanediol , Cola Acuminata (Kola) Seed Extract , Hydrolyzed Algin , Pantethine , Caffeine , Lecithin , Tripeptide-32 , Ethylhexylglycerin , Sodium Rna , Bisabolol , Glycereth-26 , Squalane , Sodium Hyaluronate , Oleth-3 Phosphate , Caprylyl Glycol , Lactobacillus Ferment , Oleth-3 , Oleth-5 , Anthemis Nobilis (Chamomile) , Yeast Extract/Faex/Extrait De Levure , Choleth-24 , Hydrogenated Lecithin , Ceteth-24 , Tocopheryl Acetate , Ethylhexyl Methoxycinnamate , Hexylene Glycol , Carbomer , Triethanolamine , Trisodium Edta , Bht , Xanthan Gum , Phenoxyethanol , Red 4 (Ci 14700) , Yellow 5 (Ci 19140)",False
PETER THOMAS ROTH,PETER THOMAS ROTH Potent-C™ Power Serum,"Water, Tetrahexyldecyl Ascorbate, Butylene Glycol, C9-12 Alkane, Caprylyl Methicone, Tocopheryl Acetate, C10-18 Triglycerides, Polyglyceryl-6 Distearate, Ferulic Acid, Squalane, Hydrogenated Lecithin, Propanediol, Sodium Hyaluronate, Zingiber Officinale (Ginger) Root Extract, Curcuma Longa (Turmeric) Root Extract, Panax Ginseng Root Extract, Jojoba Esters, Leuconostoc/Radish Root Ferment Filtrate, Coco-Caprylate/Caprate, Glycerin, Cetyl Alcohol, Polyglyceryl-3 Beeswax, Xanthan Gum, Disodium EDTA, Mica, Ethylhexylglycerin, Potassium Sorbate, Sodium Benzoate, Phenoxyethanol.",False
