Product Brand,Product Name,Ingredients,Clean Product
LA MER,LA MER Crème de la Mer,"Algae (Seaweed) Extract, Mineral Oil, Petrolatum, Glycerin, Isohexadecane, Microcrystalline Wax, Lanolin Alcohol, Citrus Aurantifolia (Lime) Extract, Sesamum Indicum (Sesame) Seed Oil, Eucalyptus Globulus (Eucalyptus) Leaf Oil, Sesamum Indicum (Sesame) Seed Powder, Medicago Sativa (Alfalfa) Seed Powder, Helianthus Annuus (Sunflower) Seedcake, Prunus Amygdalus Dulcis (Sweet Almond) Seed Meal, Sodium Gluconate, Copper Gluconate, Calcium Gluconate, Magnesium Gluconate, Zinc Gluconate, Magnesium Sulfate, Paraffin, Tocopheryl Succinate, Niacin, Water, Beta-Carotene, Decyl Oleate, Aluminum Distearate, Octyldodecanol, Citric Acid, Cyanocobalamin, Magnesium Stearate, Panthenol, Limonene, Geraniol, Linalool, Hydroxycitronellal, Citronellol, Benzyl Salicylate, Citral, Sodium Benzoate, Alcohol Denat., Fragrance.",False
LA MER,LA MER The Moisturizing Soft Cream,"Algae (Seaweed) Extract, Cyclopentasiloxane, Petrolatum, Glyceryl Distearate, Phenyl Trimethicone, Butylene Glycol, Hydrogenated Vegetable Oil, Cholesterol, Butyrospermum Parkii (Shea Butter), Steareth-10, Dimethicone, Glyceryl Stearate Se, Polysilicone-11, Sesamum Indicum (Sesame) Seed Oil, Medicago Sativa (Alfalfa) Seed Powder, Helianthus Annuus (Sunflower) Seedcake, Prunus Amygdalus Dulcis (Sweet Almond) Seed Meal, Eucalyptus Globulus (Eucalyptus) Leaf Oil, Sodium Gluconate, Copper Gluconate, Calcium Gluconate, Magnesium Gluconate, Zinc Gluconate, Tocopheryl Succinate, Niacin, Sesamum Indicum (Sesame) Seed Powder, Water, Citrus Aurantifolia (Lime) Peel Extract, Laminaria Digitata Extract, Crithmum Maritimum Extract, Salicornia Herbacea Extract, Plankton Extract, Chlorella Vulgaris Extract, Glycine Soja (Soybean) Seed Extract, Glycerin, Caffeine, Sea Salt/Maris Sal/Sel Marin, Micrococcus Lysate, Diethylhexyl Succinate, Adenosine Phosphate, Creatine, Hydrolyzed Algin, Isocetyl Stearoyl Stearate, Cetyl Alcohol, Sucrose, Acetyl Hexapeptide-8, Glucose Oxidase, Polyacrylamide, Acetyl Carnitine Hcl, Glucose, Caprylic/Capric Triglyceride, C13-14 Isoparaffin, Tocopheryl Acetate, Tetrahexyldecyl Ascorbate, Sodium Pca, Glycosaminoglycans, Urea, Distearyldimonium Chloride, Dipalmitoyl Hydroxyproline, Sodium Hyaluronate, Laureth-7, Lecithin, Trehalose, Polyquaternium-51, Lactoperoxidase, Hydroxypropyl Cyclodextrin, Cyanocobalamin, Pentylene Glycol, Fragrance, Disodium Edta, Bht, Citronellol, Hydroxycitronellal, Geraniol, Linalool, Limonene, Potassium Sorbate, Phenoxyethanol",False
KIEHL'S SINCE 1851,KIEHL'S SINCE 1851 Ultra Facial Cream,"Water, Glycerin, Cyclohexasiloxane, Squalane, Bis-Peg-18 Methyl Ether Dimethyl Silane, Sucrose Stearate, Stearyl Alcohol, Peg-8 Stearate, Urea, Myristyl Myristate, Pentaerythrityl Tetraethylhexanoate, Prunus Armeniaca Kernel Oil, Phenoxyethanol, Persea Gratissima Oil, Olea Europaea Oil, Oryza Sativa Bran Oil, Cetyl Alcohol, Glyceryl Stearate, Imperata Cylindrica Root Extract, Stearic Acid, Methylparaben, Chlorphenesin, Palmitic Acid, Disodium Edta, Acrylates/C10-30 Alkyl Acrylate Crosspolymer, Propylparaben, Carbomer, Triethanolamine, Prunus Amygdalus Dulcis Oil, Xanthan Gum, Sodium Hydroxide, Tocopherol, Pseudoalteromonas Ferment Extract, Hydroxypalmitoyl Sphinganine, Caprylyl Glycol.",False
LA MER,LA MER Little Miss Miracle Limited-Edition Crème de la Mer,"Algae (Seaweed) Extract, Mineral Oil, Petrolatum, Glycerin, Isohexadecane, Microcrystalline Wax, Lanolin Alcohol, Citrus Aurantifolia (Lime) Extract, Sesamum Indicum (Sesame) Seed Oil, Eucalyptus Globulus (Eucalyptus) Leaf Oil, Sesamum Indicum (Sesame) Seed Powder, Medicago Sativa (Alfalfa) Seed Powder, Helianthus Annuus (Sunflower) Seedcake, Prunus Amygdalus Dulcis (Sweet Almond) Seed Meal, Sodium Gluconate, Copper Gluconate, Calcium Gluconate, Magnesium Gluconate, Zinc Gluconate, Magnesium Sulfate, Paraffin, Tocopheryl Succinate, Niacin, Water, Beta-Carotene, Decyl Oleate, Aluminum Distearate, Octyldodecanol, Citric Acid, Cyanocobalamin, Magnesium Stearate, Panthenol, Limonene, Geraniol, Linalool, Hydroxycitronellal, Citronellol, Benzyl Salicylate, Citral, Sodium Benzoate, Alcohol Denat., Fragrance.",False
KIEHL'S SINCE 1851,KIEHL'S SINCE 1851 Midnight Recovery Concentrate,"Caprylic/Capric Triglyceride Dicaprylyl Carbonate Squalane Rosa Canina Fruit Oil Oenothera Biennis Oil, Evening Primrose Oil Simmondsia Chinensis Oil, Jojoba Seed Oil Coriandrum Sativum Oil, Coriander Seed Oil Tocopherol Lavandula Angustifolia Oil, Lavender Oil Pelargonium Graveolens Flower Oil Linalool Rosmarinus Officinalis Leaf Oil, Rosemary Leaf Oil Citronellol Geraniol Lavandula Hybrida Oil Cucumis Sativus Extract, Cucumber Fruit Extract Curcuma Longa Extract, Turmeric Root Extract Limonene Citral Sclareolide Rosa Spp, Rose Flower Oil Jasminum Officinale Extract, Jasmine Extract Helianthus Annuus Seed Oil, Sunflower Seed Oil.",False
CLINIQUE,CLINIQUE Moisture Surge 72-Hour Auto-Replenishing Hydrator,"Water , Dimethicone , Butylene Glycol , Glycerin , Trisiloxane , Trehalose , Sucrose , Ammonium Acryloyldimethyltaurate/Vp Copolymer , Hydroxyethyl Urea , Camellia Sinensis (Green Tea) Leaf Extract , Silybum Marianum (Lady'S Thistle) Extract , Betula Alba (Birch) Bark Extract , Saccharomyces Lysate Extract , Aloe Barbadensis Leaf Water , Thermus Thermophillus Ferment , Caffeine , Sorbitol , Palmitoyl Hexapeptide-12 , Sodium Hyaluronate , Caprylyl Glycol , Oleth-10 , Sodium Polyaspartate , Saccharide Isomerate , Hydrogenated Lecithin , Tocopheryl Acetate , Acrylates/C10-30 Alkyl Acrylate Crosspolymer , Glyceryl Polymethacrylate , Tromethamine , Peg-8 , Hexylene Glycol , Magnesium Ascorbyl Phosphate , Disodium Edta , Bht , Phenoxyethanol , Red 4 (Ci 14700) , Yellow 5 (Ci 19140)",False
LA MER,LA MER Crème de la Mer Mini,"Algae (Seaweed) Extract, Mineral Oil, Petrolatum, Glycerin, Isohexadecane, Microcrystalline Wax, Lanolin Alcohol, Citrus Aurantifolia (Lime) Extract, Sesamum Indicum (Sesame) Seed Oil, Eucalyptus Globulus (Eucalyptus) Leaf Oil, Sesamum Indicum (Sesame) Seed Powder, Medicago Sativa (Alfalfa) Seed Powder, Helianthus Annuus (Sunflower) Seedcake, Prunus Amygdalus Dulcis (Sweet Almond) Seed Meal, Sodium Gluconate, Copper Gluconate, Calcium Gluconate, Magnesium Gluconate, Zinc Gluconate, Magnesium Sulfate, Paraffin, Tocopheryl Succinate, Niacin, Water, Beta-Carotene, Decyl Oleate, Aluminum Distearate, Octyldodecanol, Citric Acid, Cyanocobalamin, Magnesium Stearate, Panthenol, Limonene, Geraniol, Linalool, Hydroxycitronellal, Citronellol, Benzyl Salicylate, Citral, Sodium Benzoate, Alcohol Denat., Fragrance.",False
SHISEIDO,SHISEIDO Bio-Performance Advanced Super Revitalizing Cream,"Water, Glycerin, Cyclomethicone, Butylene Glycol, Dimethicone, Cetyl Octanoate, Squalane, Dimethicone Copolyol, Disteardimonium Hectorite, Hydrogenated C6-14 Olefin Polymers, PEG-150, Mortierella Oil, Phytosteryl Macadamiate, Tocopheryl Acetate, Stearyl Glycyrrhetinate, Arginine HCI, PEG-60 Hydrogenated Castor Oil, Sodium Glutamate, Disodium Adenosine Triphosphate, Saccharomyces Lysate Extract, Sodium Acetylated Hyaluronate, Rosa Roxburghii Extract, Octyl Methoxycinnamate, Agar, Sodium Hexametaphosphate, Trisodium EDTA, Tocopherol, BHT, Ethylparaben, Butylparaben, Methylparaben, Fragrance, Iron Oxides.",False
CLINIQUE,CLINIQUE Dramatically Different Moisturizing Lotion+,"Water , Mineral Oil/Paraffinum Liquidum/Huile Minerale , Glycerin , Petrolatum , Stearic Acid , Glyceryl Stearate , Sesamum Indicum (Sesame) Oil , Urea , Lanolin Alcohol , Triethanolamine , Hordeum Vulgare (Barley) Extract/Extrait D'Orge , Cucumis Sativus (Cucumber) Fruit Extract , Helianthus Annuus (Sunflower) Seedcake , Propylene Glycol Dicaprate , Sodium Hyaluronate , Butylene Glycol , Pentylene Glycol , Trisodium Edta , Phenoxyethanol , Yellow 6 (Ci 15985) , Yellow 5 (Ci 19140) , Red 33 (Ci 17200)",False
DR. JART+,DR. JART+ Premium Beauty Balm SPF 45,#NAME?,False
SHISEIDO,SHISEIDO Benefiance WrinkleResist24 Night Cream,"Water, Cetyl Ethylhexanoate, Glycerin, Butylene Glycol, Cetearyl Alcohol, Caprylic/Capric Triglyceride, Nylon-12, Phytosteryl Macadamiate, Glyceryl Stearate, Sd Alcohol 40-B (Alcohol Denat.), Isododecane, Dimethicone, Phenoxyethanol, Beheneth-20, Fragrance (Parfum), Peg/Ppg-17/4 Dimethyl Ether, Alcohol, Carbomer, Sodium Citrate, Trisodium Edta, Tocopheryl Acetate, Dipotassium Glycyrrhizate, Citric Acid, Potassium Hydroxide, Xanthan Gum, Butylphenyl Methylpropional, Sodium Metaphosphate, Limonene, Linalool, Citronellol, Sapindus Mukurossi Peel Extract (Sapindus Mukurossi), Alpha-Isomethyl Ionone, Geraniol, Benzyl Benzoate, Hexyl Cinnamal, Uncaria Gambir Extract (Uncaria Gambir), Sodium Acetylated Hyaluronate, Hydroxyproline, Iron Oxides (Ci 77491), Tocopherol, Hypericum Erectum Extract, Chlorella Vulgaris Extract.",False
CLINIQUE,CLINIQUE Dramatically Different Moisturizing Gel,"Water , Dimethicone , Isododecane , Butylene Glycol , Bis-Peg-18 Methyl Ether Dimethyl Silane , Glycerin , Laminaria Saccharina Extract , Polygonum Cuspidatum Root Extract , Saccharomyces Lysate Extract , Cucumis Sativus (Cucumber) Fruit Extract , Hordeum Vulgare (Barley) Extract/Extrait D'Orge , Helianthus Annuus (Sunflower) Seedcake , Caffeine , Trehalose , Sodium Hyaluronate , Tocopheryl Acetate , Chamomilla Recutita (Matricaria) , Polysilicone-11 , Silica , Propylene Glycol Dicaprate , Oleth-10 , Lactobacillus Ferment , Laureth-23 , Laureth-4 , Ammonium Acryloyldimethyltaurate/Vp Copolymer , Carbomer , Caprylyl Glycol , Hexylene Glycol , Tromethamine , Disodium Edta , Phenoxyethanol , Potassium Sorbate , Yellow 5 (Ci 19140) , Red 4 (Ci 14700) , Yellow 6 (Ci 15985)",False
LA MER,LA MER The Renewal Oil,"Limnanthes Alba (Meadowfoam) Seed Oil, Dimethicone, Caprylic/Capric Triglyceride, Water, Trisiloxane, Prunus Amygdalus Dulcis (Sweet Almond) Oil, Simmondsia Chinensis (Jojoba) Seed Oil, Polydecene, Hydrogenated Polydecene, Butylene Glycol, Propanediol, Glycerin, Algae (Seaweed) Extract, Brassica Campestris (Rapeseed) Seed Oil, Helianthus Annuus (Sunflower) Seed Oil, Sesamum Indicum (Sesame) Seed Oil, Eucalyptus Globulus (Eucalyptus) Leaf Oil, Camelina Sativa Seed Oil, Oxycoccus Palustris (Cranberry) Seed Oil, Olea Europaea (Olive) Fruit Oil, Hippophae Rhamnoides Oil, Medicago Sativa (Alfalfa) Seed Powder, Helianthus Annuus (Sunflower) Seedcake, Prunus Amygdalus Dulcis (Sweet Almond) Seed Meal, Sodium Gluconate, Copper Gluconate, Calcium Gluconate, Magnesium Gluconate, Zinc Gluconate, Tocopheryl Succinate, Niacin, Sesamum Indicum (Sesame) Seed Powder, Laminaria Ochroleuca Extract, Laminaria Saccharina Extract, Hydrolyzed Algin, Sea Salt/Maris Sal/Sel Marin, Chlorella Vulgaris Extract, Salicornia Herbacea Extract, Sigesbeckia Orientalis (St. Paul'S Wort) Extract, Laminaria Digitata Extract, Rosmarinus Officinalis (Rosemary) Leaf Extract, Magnolia Officinalis Bark Extract, Yeast Extract/Faex/Extrait De Levure, Crithmum Maritimum Extract, Commiphora Mukul Resin Extract, Citrus Aurantifolia (Lime) Peel Extract, Molasses Extract/Saccharum Officinarum/Extrait De Melasse, Sucrose, Acetyl Hexapeptide-8, Acetyl Glucosamine, Caffeine, Tocopheryl Acetate, Phenyl Trimethicone, Sodium Chloride, Tetrahexyldecyl Ascorbate, Alcohol Denat., Fragrance, Hexyl Cinnamal, Linalool, Amyl Cinnamal, Geraniol, Limonene, Citral, Benzyl Benzoate, Coumarin, Citronellol, Bht, Phenoxyethanol, Yellow 5 (Ci 19140), Yellow 6 (Ci 15985)",False
SHISEIDO,SHISEIDO Eudermine Revitalizing Essence,Visit the Shiseido boutique,False
ESTÉE LAUDER,ESTÉE LAUDER Micro Essence Skin Activating Treatment Lotion,"Micro Essence Skin Act Treat Lot Division: El (Estee Lauder)Ingredients: Water , Bifida Ferment Lysate , Peg-75 , Propanediol , Butylene Glycol , Betaine , Pentylene Glycol , Lactobacillus Ferment , Acetyl Hexapeptide-8 , Acetyl Glucosamine , Trehalose , Caffeine , Sodium Hyaluronate , Anthemis Nobilis (Chamomile) , Caprylyl Glycol , Carbomer , Ppg-5-Ceteth-20 , Citric Acid , Potassium Sorbate , Sodium Citrate , Tromethamine , Disodium Edta , Phenoxyethanol",False
DR. JART+,DR. JART+ Cicapair ™ Tiger Grass Color Correcting Treatment SPF 30,"Water, Centella Asiatica Leaf Water, Isononyl Isononanoate, Cyclopentasiloxane, Butylene Glycol, Dimethicone, Phenyl Trimethicone, Methyl Methacrylate Crosspolymer, Beeswax/Cire D'abeille, Glycerin, Diethylhexyl Carbonate, Polyglyceryl-3 Polyricinoleate, Niacinamide, Polymethylsilsesquioxane, Cyclohexasiloxane, Pan-Thenol, Diglycerin, Iron Oxides, Polyglyceryl-4 Diisostearate/Polyhydroxystearate/Sebacate, Dimethicone/Vinyl Dimethi- Cone Crosspolymer, Isododecane, Ethylene/Methacrylate Copolymer, Cetearyl Alcohol, Polyglyceryl-2 Triisostearate, Aluminum Hydroxide, Stearic Acid, Disteardimonium Hectorite, Acrylates/Ammonium Methacrylate Copolymer, Sclerotium Gum, Sodium Benzoate, Acrylates/Dimethicone Copolymer, Hydrogen Dimethicone, Chromium Oxide Greens, Triethyl Citrate, Potassium Sorbate, Fragaria Vesca (Strawberry) Leaf Extract, Disodium EDTA, BHT, Alcohol, Asiaticoside, Aden- Osine, Triethoxycaprylylsilane, Lavandula Angustifolia (Lavender) Oil, Boron Nitride, Asiatic Acid, Madecassic Acid, Citrus Grandis (Grapefruit) Peel Oil, Rosmarinus Officinalis (Rosemary) Leaf Oil, 1,2- Hexanediol, Anthemis Nobilis Flower Oil, Houttuynia Cordata Extract, Propanediol, Centella Asiatica Extract, Gentiana Lutea Root Extract, Artemisia Absinthium Extract, Achillea Millefolium Extract, Arnica Montana Flower Extract, Polysorbate 20, Aniba Rosodora (Rosewood) Wood Oil, Sodium Glycerophosphate, Selaginella Lepidophylla Extract, Potassium Magnesium Aspartate, Citric Acid, Calcium Gluconate, Madecassoside, Magnesium Gluconate, Centella Asiatica Meristem Cell Culture, Xanthan Gum, Titanium Dioxide, Zinc Oxide.",False
ESTÉE LAUDER,ESTÉE LAUDER Revitalizing Supreme Global Anti-Aging Crème,"Revitalizing Supreme+ Cell Pwr Crm Division: El (Estee Lauder)Ingredients: Water , Dimethicone , Glycerin , Isohexadecane , Butylene Glycol , Bis-Peg-18 Methyl Ether Dimethyl Silane , Peg-10 Dimethicone , Disteardimonium Hectorite , Pentylene Glycol , Cucumis Sativus (Cucumber) Fruit Extract , Narcissus Tazetta Bulb Extract , Magnolia Officinalis Bark Extract , Hordeum Vulgare (Barley) Extract/Extrait D'Orge , Sigesbeckia Orientalis (St. Paul'S Wort) Extract , Lens Esculenta (Lentil) Fruit Extract , Pyrus Malus (Apple) Fruit Extract , Whey Protein/Lactis Protein/Proteine Du Petit-Lait , Citrullus Vulgaris (Watermelon) Fruit Extract , Moringa Oleifera Seed Extract , Laminaria Digitata Extract , Triticum Vulgare (Wheat) Germ Extract , Opuntia Tuna Extract , Acetyl Hexapeptide-8 , Sorbitol , Helianthus Annuus (Sunflower) Seedcake , Caffeine , Algae Extract , Sodium Hyaluronate , Sodium Lactate , Squalane , Polysilicone-11 , Isododecane , Tocopheryl Acetate , Sucrose , Acetyl Glucosamine , Polyethylene , Propylene Carbonate , Citric Acid , Peg-32 , Propylene Glycol Dicaprate , Peg-6 , Isoceteth-20 , Sodium Dehydroacetate , Aminopropyl Ascorbyl Phosphate , Fragrance , Sodium Pca , Sodium Citrate , Disodium Edta , Bht , Phenoxyethanol , Iron Oxides (Ci 77491)",False
DR. JART+,DR. JART+ Ceramidin™ Cream,"Water, Glycerin, Dipropylene Glycol, Cetearyl Alcohol, Caprylic/Capric Triglyceride, Hydrogenated Poly(C6-14 Olefin), Hydrogenated Polydecene, Methyl Trimethicone, 1, 2-Hexanediol, Bifida Ferment Lysate, Phenyl Trimethicone, Vegetable Oil, Butyrospermum Parkii (Shea) Butter, Glyceryl Stearate SE, Ceramide NP, Stearic Acid, Algae Extract, Eclipta Prostrata Leaf Extract, Cetearyl Glucoside, Hydrogenated Lecithin, Microcrystalline Cellulose, Butylene Glycol, C12-16 Alcohols, Ammonium Acryloyldimethyltaurate/VP Copolymer, Malt Extract, Beta Vulgaris (Beet) Root Extract, Melia Azadirachta Flower Extract, Melia Azadirachta Leaf Extract, Throbroma Caco (Cocoa) Seed Extract, Curuma Longa (Turmeric) Root Extract, Ocimum Sanctum Leaf Extract, Amaranthus Caudatus Seed Extract, Ulmus Davidiana Root Extract, Avena Sativa (Oat) Kernel Extract, Cynara Scolymus (Artichoke) Leaf Extract, Pteris Multifida Extract, Artemisia Vulgaris Extract, Corallina Officinalis Extract, Pyracantha Fortuneana Fruit Extract, Glycerly Polymethacrylate, Cholesterol, Citrus Aurantium Bergamia (Bergamot) Fruit Oil, Hydrolyzed Corn Starch, Sodium Hyaluronate, Pelargonium Graveolens Flower Oil, Fructooligosaccharides, Beta-Glucan, Dextrin, Disodium EDTA, Panthenol, Polyquaternium-51, Raffinose, Hydrolyzed Hyaluronic Acid, Folic Acid, Salvia Officinalis (Sage) Oil, Pogostemon Cablin Oil, Tromethamine, Ceramide AP, Ceramide AS, Ceramide NS, Palmitoyl Pentapeptide-4, Ceramide EOP.",False
PETER THOMAS ROTH,PETER THOMAS ROTH Water Drench Hyaluronic Cloud Cream,"Water, Glycerin, Cyclopentasiloxane, Dipropylene Glycol, Dimethicone, Cyclohexasiloxane, Yeast Extract, Sodium Hyaluronate, Ceramide Eop, Ceramide Eos, Ceramide Ap, Ceramide Np, Ceramide Ns, Sambucus Nigra Fruit Extract, Hydrolyzed Silk, Sodium Pca, Tocopherol, Ascorbyl Palmitate, Caprooyl Phytosphingosine, Caprooyl Sphingosine, Saccharide Isomerate, Saccharomyces/Magnesium Ferment, Saccharomyces/Iron Ferment, Saccharomyces/Copper Ferment, Saccharomyces/Silicon Ferment, Saccharomyces/Zinc Ferment, Olea Europaea (Olive) Leaf Extract, Methyl Gluceth-20, Ethylhexylglycerin, Lauryl Peg-9 Polydimethylsiloxyethyl Dimethicone, Cholesterol, Sodium Chloride, Sodium Citrate, Citric Acid, Behenic Acid, Propylene Glycol, Ceteareth-25, Butylene Glycol, Dimethicone/Peg-10/15 Crosspolymer, Cetyl Alcohol, Diso- Dium Edta, Sodium Benzoate, Potassium Sorbate, Phenoxyethanol, Mica.",False
SHISEIDO,SHISEIDO Benefiance WrinkleResist24 Day Cream Broad Spectrum SPF 18,"Water, Glycerin, Dipropylene Glycol, Butylene Glycol, Phenyl Trimethicone, Hydrogenated Polydecene, Sorbitol, Myristyl Myristate, Dimethicone, Sd Alcohol 40-B, Polybutylene Glycol/Ppg-9/1 Copolymer, Petrolatum, Stearyl Alcohol, Stearic Acid, Silica, Bentonite, Palmitic Acid, Xanthan Gum, Peg/Ppg-17/4 Dimethyl Ether, Phytosteryl Macadamiate, Tocopheryl Acetate, Sapindus Mukurossi Peel Extract, Uncaria Gambir Extract, Sodium Acetylated Hyaluronate, Hydroxyproline, Thymus Serpillum Extract, Chlorella Vulgaris Extract, Peg-5 Glyceryl Stearate, Glyceryl Stearate Se, Trisodium Edta, Potassium Hydroxide, Sodium Metaphosphate, Ammonium Acryloyldimethyltaurate/Vp Copolymer, Alcohol, Sodium Metabisulfite, Bht, Tocopherol, Phenoxyethanol, Fragrance, Iron Oxides.",False
CLINIQUE,CLINIQUE Moisture Surge Intense Skin Fortifying Hydrator,"Water , Cyclopentasiloxane , Glycerin , Butylene Glycol , Dimethicone , Cetyl Ethylhexanoate , Squalane , Disteardimonium Hectorite , Peg/Ppg-18/18 Dimethicone , Lauryl Peg-9 Polydimethylsiloxyethyl Dimethicone , Ahnfeltia Concinna Extract , Olea Europaea (Olive) Fruit Extract , Caffeine , Whey Protein/Lactis Protein/Proteine Du Petit-Lait , Cholesterol , Sodium Hyaluronate , Petrolatum , Peg-150 , Sucrose , Pyridoxine Dipalmitate , Linoleic Acid , Tocopheryl Acetate , Citric Acid , Polysilicone-11 , Propylene Carbonate , Glyceryl Polymethacrylate , Peg-8 , Aloe Barbadensis Leaf Extract , Triticum Vulgare (Wheat) Bran Extract , Pentaerythrityl Tetra-Di-T-Butyl Hydroxyhydrocinnamate , Palmitoyl Hexapeptide-12 , Sodium Citrate , Sodium Hexametaphosphate , Chlorphenesin , Phenoxyethanol",False
LA MER,LA MER The Concentrate Mini,"Cyclopentasiloxane, Algae (Seaweed) Extract, Glycerin, Dimethicone, Polysilicone-11, Isononyl Isononanoate, Dimethicone/Peg-10/15 Crosspolymer, Sesamum Indicum (Sesame) Seed Oil, Medicago Sativa (Alfalfa) Seed Powder, Helianthus Annuus (Sunflower) Seedcake, Prunus Amygdalus Dulcis (Sweet Almond) Seed Meal, Eucalyptus Globulus (Eucalyptus) Leaf Oil, Sodium Gluconate, Copper Gluconate, Calcium Gluconate, Magnesium Gluconate, Zinc Gluconate, Tocopheryl Succinate, Niacin, Sesamum Indicum (Sesame) Seed Powder, Water, Dimethicone Crosspolymer, Helichrysum Arenarium (Everlasting) Extract, Laminaria Ochroleuca Extract, Triticum Vulgare (Wheat) Flour Lipids, Citrus Aurantifolia (Lime) Peel Extract, Crithmum Maritimum Extract, Alteromonas Ferment Extract, Chlorella Vulgaris Extract, Yeast Extract/Faex/Extrait De Levure, Cholesterol, Linoleic Acid, Tetraacetylphytosphingosine, Caprylic/Capric Triglyceride, Rosmarinus Officinalis (Rosemary) Leaf Oil, Ocimum Basilicum (Basil) Oil, Lavandula Angustifolia (Lavender) Oil, Lavandula Hybrida (Lavandin) Oil, Dipropylene Glycol, Sodium Citrate, Limonene, Linalool, Phenoxyethanol",False
LA MER,LA MER The Moisturizing Cool Gel Cream,Visit the La Mer boutique,False
LANCÔME,LANCÔME Rénergie Lift Multi-Action Night,"Water, Glycerin, Prunus Armeniaca Kernel Oil, Apricot Kernel Oil, Caprylic/Capric Triglyceride, Pentaerythrityl Tetraethylhexanoate, Cetyl Alcohol, Zea Mays Starch, Corn Starch, Butyrospermum Parkii Butter, Shea Butter, Alcohol Denat., Petrolatum, Pentylene Glycol, Glyceryl Stearate, Dimethicone, Peg-40 Stearate, Cera Alba, Beeswax, Cire Dabeille, Hydroxyethylpiperazine Ethane Sulfonic Acid, Ci 14700, Red 4, Ci 19140, Yellow 5, Saccharomyces/Xylinum/ Black Tea Ferment, Hydrolyzed Linseed Extract, Hydrolyzed Soy Protein, Hydrolyzed Hyaluronic Acid, Sodium Hydroxide, Sodium Benzoate, Phenoxyethanol, Adenosine, Stearyl Alcohol, Acetyl Tetrapeptide-9, Poloxamer 338, Dimethiconol, Limonene, Xanthan Gum, Pentaerythrityl Tetra-Di-T-Butyl Hydroxyhydrocinnamate, Benzyl Alcohol, Caprylyl Glycol, Alpha-Isomethyl Ionone, Sorbitan Tristearate, Myristyl Alcohol, Geraniol, Hexyl Cinnamal, Fragrance.",False
DR. JART+,DR. JART+ Cicapair™ Tiger Grass Cream,"Water, Propanediol, Centellaasiaticaleafwater, Butylene Glycol, Caprylic/Ca- Prictriglyceride, Panthenol, Diisostearylmalate, Polyglyceryl-3 Methylglucose Dis- Tearate, Butyrospermum Parkii (Shea) Bu-Tter, Glycerylstearate, Niacinamide, Mac- Adamiaternifolia Seed Oil, Cetearyl Alco-Hol, Hydrogenatedpoly(C6-14 Olefin), Hy- Drogenated Polydecene, Hydrogenatedpolyisobutene, 1, 2-Hexanediol, PEG-8, PEG-100 Stearate, Polyacrylate-13, Palm-Iticacid, Tocopherylacetate, Beeswax/Cire D'abeille, Glycerin, Stearicacid, Phe-Noxyethanol, Polyisobutene, Asiaticoside, Carbomer, Tromethamine, Madecassic A-Cid, Asiaticacid, Spirulina Platensispow- Der, Alcohol, Polysorbate20, Ethylhexylgl-Ycerin, Lavandulaangustifolia (Lavender) Oil, Sorbitan Isostearate, Adenosine, Cer-Amidenp, Citrusgrandis (Grapefruit) Peel Oil, Hydrogenatedlecithin, Disodium EDTA, Rosmarinus Officinalis (Rosemary) Leafoil, Anthemisnobilis Flower Oil, Sodiumhya-Luronate, Centellaasiatica Extract, Theob-Roma Cacao (Cocoa) Extract, Dextrin, Ho- Uttuyniacordataextract, Anibarosodora (Rosewood)Wood Oil, Centella Asiaticameristem Cell Culture, Madecassoside, Citric Acid, Achillea Millefolium Extract, Ar-Temisia Absinthium Extract, Arnicamonta-Na Flower Extract, Gentiana Lutearoot Extract, Sucrose Laurate, Sodium Glycero-Phosphate, Selaginella Lepidophylla Extr- Act, Potassiummagnesiumaspartate, Ly-Solecithin, Magnesiumgluconate, Calciumgluconate, Potassium Sorbate, Sodiumascorbylphosphate, Sodiumbenzoate, Xanthan Gum.",False
CLINIQUE,CLINIQUE Dramatically Different Hydrating Jelly,"Water, Bis-Peg-18 Methyl Ether Dimethyl Silane, Butylene Glycol, Glycerin, Cucumis Sativus (Cucumber) Fruit Extract, Hypnea Musciformis (Algae) Extract, Gelidiella Acerosa Extract, Hordeum Vulgare (Barley) Extract/Extrait D'orge, Padina Pavonica Thallus Extract, Helianthus Annuus (Sunflower) Seedcake, Sucrose, Caffeine, Sodium Hyaluronate, Hydroxyethyl Urea, Hydrolyzed Rice Extract, Sorbitol, Sodium Polyaspartate, Ppg-6-Decyltetradeceth-30, Ethylhexylglycerin, Propylene Glycol Dicaprate, Caprylyl Glycol, Trehalose, Polysorbate 80, Carbomer, Sodium Hydroxide, Hexylene Glycol, Citric Acid, Sodium Citrate, Disodium Edta, Phenoxyethanol.",False
SHISEIDO,SHISEIDO Benefiance WrinkleResist24 Balancing Softener Enriched,Visit the Shiseido boutique,False
KIEHL'S SINCE 1851,KIEHL'S SINCE 1851 Super Multi-Corrective Cream,"Water, Glycerin, Dicaprylyl Ether, Butyrospermum Parkii Butter/Shea Butter, Hydroxypropyl Tetrahydropyrantriol, Isononyl Isononanoate, Isopropyl Isostearate, Propylene Glycol, Sodium Tetrahydrojasmonate, Cetyl Alcohol, Dimethicone, Behenyl Alcohol, Dipropylene Glycol, Stearic Acid, Glyceryl Stearate, Palmitic Acid, Phenoxyethanol, Cetearyl Alcohol, Carbomer, Arachidyl Alcohol, Caprylyl Glycol, PEG-100 Stearate, Xanthan Gum, Sodium Hydroxide, Cetearyl Glucoside, Stearyl Alcohol, Hydrolyzed Hyaluronic Acid, Disodium EDTA, Rosmarinus Officinalis Leaf Oil/Rosemary Leaf Oil, Adenosine, Limonene, Pelargonium Graveolens Flower Oil, Lavandula Hybrida Oil, Cucumis Sativus Fruit Extract/Cucumber Fruit Extract, Curcuma Longa Extract/Turmeric Root Extract, Sclareolide, Rosa SPP/Rose Flower Oil, Jasminum Officinale Extract/ Jasmine Extract, Citric Acid.",False
SHISEIDO,SHISEIDO Bio-Performance Advanced Super Restoring Cream,"Dimethicone, Cetyl Alcohol, Glyceryl Stearate Se, Peg-100 Stearate, Myristyl Myristate, Hydrogenated Polyisobutene, Erythritol, Microcrystalline Wax (Cera Microcristallina), Behenyl Alcohol, Dimethylacrylamide/Sodium Acryloyldimethyltaurate Crosspolymer, Stearyl Alcohol, Talc, Phenoxyethanol, Methylparaben, Silica, Alumina, Disodium Edta, Sorbitan Tristearatee, Thylparaben, Fragrance, Sodium Citrate, Titanium Dioxide (Ci 77891), Tocopheryl Acetate, Citric Acid, Sodium Metaphosphate, Inositol, Benzyl Benzoate, Alpha-Isomethyl Ionone, Saccharomyces Ferment Lysate Filtrate, Hexyl Cinnamal, Linalool, Limonene, Methylisothiazolinone, Sodium Metabisulfite, Citronellol, Geraniol, Butylphenyl Methylpropional, Sodium Acetylated Hyaluronate, Eugenol, Syzygium Jambos Leaf Extract, Iron Oxides (Ci 77491), Iron Oxides (Ci 77492), Tocopherol.",False
